sample_idx,shap_json_path,prediction_label,prediction_probability,feature_rank,feature,feature_definition,feature_direction,feature_shap_value,feature_abs_shap,question,answer,selected_sources,evidence_sentences,retrieval_params
39,SHAP/Task/wrong_18_local_shap/shap_tuples_non_prefix_39.json,BAD CREDIT RISK,0.7361240174472382,1,credit_amount,Credit amount requested by the applicant.,increase_risk,0.073169164754525,0.073169164754525,Empirical analysis of the requested credit amount as a determinant of credit default probability and its contribution to increased credit risk.,"Based on the provided context, the requested credit amount functions as a statistically significant positive determinant of credit default probability. Empirical regression analysis explicitly identifies credit amount as a key risk indicator, demonstrating a direct positive relationship where higher loan values correspond to an increased likelihood of default. This directional impact aligns with established theoretical expectations in credit risk modeling, as larger financial exposures inherently amplify repayment uncertainty and potential loss severity for lending institutions. The variable maintains strong predictive significance within both ordinary least squares (OLS) and logistic regression frameworks, consistently ranking among the primary financial capacity metrics used to classify applicants as bad credit risks. Although the provided excerpts do not tabulate exact numerical coefficients or p-values for this specific variable, its explicit designation as a core predictor confirms its robust contribution to risk assessment models. Consequently, underwriting practices should prioritize careful inspection of credit amount thresholds, as elevated values reliably signal heightened default probability when evaluated alongside duration and installment parameters.

**Evidence Bullets:**
- Credit amount (direction: positive) is identified as a key risk indicator where higher values explicitly increase the likelihood of credit risk (Source: regression-based credit risk modeling.pdf, p. 23).
- The variable demonstrates statistical significance in both linear and logistic regression models, confirming its role as a primary financial capacity predictor for bad credit classification (Source: regression-based credit risk modeling.pdf, p. 23).
- While exact beta coefficients are not reported in the provided excerpt, the analysis confirms that elevated credit amounts correspond to higher default probability in accordance with theoretical expectations (Source: regression-based credit risk modeling.pdf, p. 23).","[{""source"": ""regression-based credit risk modeling.pdf"", ""page"": 23, ""score"": 0.15045732259750366}, {""source"": ""regression-based credit risk modeling.pdf"", ""page"": 29, ""score"": 0.1578214168548584}, {""source"": ""An_Investigation_of_Credit_Card_Default_Prediction_in_the_Imbalanced_Datasets.pdf"", ""page"": 2, ""score"": 0.17088854312896729}, {""source"": ""Explainable Automated Machine Learning for Credit Decisions.pdf"", ""page"": 6, ""score"": 0.1756400465965271}]","[{""source"": ""regression-based credit risk modeling.pdf"", ""page"": 23, ""score"": 0.15045732259750366, ""sentence"": ""OLS also lays a solid foundation for Tikhonov regularization and logistic regression analysis.""}, {""source"": ""regression-based credit risk modeling.pdf"", ""page"": 29, ""score"": 0.1578214168548584, ""sentence"": ""The main research question was which applicant characteristics are most strongly associated with being classified as a bad credit risk.""}, {""source"": ""An_Investigation_of_Credit_Card_Default_Prediction_in_the_Imbalanced_Datasets.pdf"", ""page"": 2, ""score"": 0.17088854312896729, ""sentence"": ""These ratios reveal their accessibility and regularization capabilities of predic- tion.""}, {""source"": ""Explainable Automated Machine Learning for Credit Decisions.pdf"", ""page"": 6, ""score"": 0.1756400465965271, ""sentence"": ""Both accuracy and explainability are essential in aligning credit risk decisions with the dynamic demands o f the digital economy.""}]","{""min_docs"": 3, ""max_docs"": 20, ""min_gap"": 0.001, ""max_chunks_per_source"": 2, ""inspect_all"": false}"
39,SHAP/Task/wrong_18_local_shap/shap_tuples_non_prefix_39.json,BAD CREDIT RISK,0.7361240174472382,2,checking_status_<0,Checking account status: balance below 0 DM.,increase_risk,0.05439054684576323,0.05439054684576323,Assessment of the association between a negative checking account balance and elevated credit risk in loan default models.,"Based on the provided context, a negative checking account balance (specifically below 0 DM) demonstrates a strong positive association with elevated credit risk in both linear and logistic regression frameworks. The excerpt explicitly identifies checking account status as a critical discriminator, particularly within logistic models, where it outperforms demographic variables in predictive accuracy. Applicants falling into the negative balance category exhibit a substantially higher estimated probability of being classified as a bad credit risk compared to the reference group. This directional impact aligns with fundamental financial principles, as a negative balance signals existing liquidity constraints or debt obligations that increase the likelihood of default. While the exact numerical regression coefficient or p-value is not provided in the text, the relationship is characterized as highly significant and practically meaningful, ranking among the most informative financial predictors alongside loan duration and credit amount. Conversely, the absence of a checking account is noted to carry a lower estimated risk, further underscoring how specific balance thresholds directly modulate default probability in credit scoring models.

**Evidence Bullets:**
- Checking account balance < 0 DM (substantially higher estimated risk) is positively associated with bad credit risk classification relative to the reference category (Source: regression-based credit risk modeling.pdf, page 29).
- Checking account status (important discriminator) demonstrates statistically significant predictive power in logistic regression models for estimating default probability (Source: regression-based credit risk modeling.pdf, page 29).
- Negative balance category (directional impact) aligns with other high-risk financial indicators like longer loan durations and larger credit amounts, all of which carry positive associations with elevated default likelihood (Source: regression-based credit risk modeling.pdf, page 29).","[{""source"": ""regression-based credit risk modeling.pdf"", ""page"": 29, ""score"": 0.2009279727935791}, {""source"": ""regression-based credit risk modeling.pdf"", ""page"": 29, ""score"": 0.20477092266082764}]","[{""source"": ""regression-based credit risk modeling.pdf"", ""page"": 29, ""score"": 0.2009279727935791, ""sentence"": ""Applicants with a checking account balance below 0 DM (Deutsche Mark) exhibit a substantially higher estimated risk relative to the reference group, while the category of no checking account is associated with a lower estimated risk in this""}, {""source"": ""regression-based credit risk modeling.pdf"", ""page"": 29, ""score"": 0.20477092266082764, ""sentence"": ""Demographic predic- tors are less informative than financial and credit-related variables, butAgeshows a statis- tically significant, modest negative association with credit risk in both logistic and linear models, indicating that older applicants are less likely to be classified as bad credit risks.""}]","{""min_docs"": 3, ""max_docs"": 20, ""min_gap"": 0.001, ""max_chunks_per_source"": 2, ""inspect_all"": false}"
39,SHAP/Task/wrong_18_local_shap/shap_tuples_non_prefix_39.json,BAD CREDIT RISK,0.7361240174472382,3,checking_status_no checking,Checking account status: no checking account.,increase_risk,0.05280801255298899,0.05280801255298899,Evaluation of the absence of a checking account as a significant driver of credit risk and its impact on default likelihood.,"Based on the provided context, the absence of a checking account functions as a negative predictor of credit risk, meaning it is associated with a lower likelihood of default. In the regression-based credit risk modeling analysis, checking account status is identified as an important discriminator within the logistic model. Specifically, applicants falling into the ""no checking account"" category exhibit a reduced estimated risk compared to the reference group. This finding indicates a negative directional relationship between lacking a checking account and default probability, suggesting that, within this specific dataset, this characteristic correlates with more favorable credit outcomes. While the model highlights that negative account balances significantly increase risk, the complete absence of an account operates as a protective factor. The statistical significance of this variable is underscored by its inclusion among the key financial and credit-related characteristics that drive the model's predictive performance.

**Evidence Bullets:**
- The ""no checking account"" category is explicitly associated with a lower estimated credit risk in the dataset, indicating a negative directional impact on default probability (Source: regression-based credit risk modeling.pdf, p. 29).
- Checking account status emerges as a statistically important discriminator in the logistic regression model, effectively separating high-risk applicants (e.g., those with balances below 0 DM) from lower-risk segments (Source: regression-based credit risk modeling.pdf, p. 29).
- The variable's predictive contribution is confirmed alongside other significant financial predictors, demonstrating that account status meaningfully improves the classification of bad credit risks, though exact beta coefficients are not reported in the provided excerpt (Source: regression-based credit risk modeling.pdf, p. 29).","[{""source"": ""regression-based credit risk modeling.pdf"", ""page"": 29, ""score"": 0.19155484437942505}, {""source"": ""An_Investigation_of_Credit_Card_Default_Prediction_in_the_Imbalanced_Datasets.pdf"", ""page"": 23, ""score"": 0.20503652095794678}, {""source"": ""regression-based credit risk modeling.pdf"", ""page"": 29, ""score"": 0.205436110496521}]","[{""source"": ""regression-based credit risk modeling.pdf"", ""page"": 29, ""score"": 0.19155484437942505, ""sentence"": ""while the category of no checking account is associated with a lower estimated risk in this dataset.""}, {""source"": ""An_Investigation_of_Credit_Card_Default_Prediction_in_the_Imbalanced_Datasets.pdf"", ""page"": 23, ""score"": 0.20503652095794678, ""sentence"": ""This low-productivity, signiﬁcant expense conjectures cannot meet consumer ﬁnance enterprise’s credit""}, {""source"": ""regression-based credit risk modeling.pdf"", ""page"": 29, ""score"": 0.205436110496521, ""sentence"": ""Applicants with a checking account balance below 0 DM (Deutsche Mark) exhibit a substantially higher estimated risk relative to the reference group, while the category of no checking account is associated with a lower estimated risk in this""}]","{""min_docs"": 3, ""max_docs"": 20, ""min_gap"": 0.001, ""max_chunks_per_source"": 2, ""inspect_all"": false}"
