sample_idx,shap_json_path,prediction_label,prediction_probability,feature_rank,feature,feature_definition,feature_direction,feature_shap_value,feature_abs_shap,question,answer,selected_sources,evidence_sentences,retrieval_params
19,SHAP/Task/correct_102_local_shap/shap_tuples_non_prefix_19.json,GOOD CREDIT RISK,0.20826460898363966,1,checking_status_no checking,Checking account status: no checking account.,decrease_risk,-0.10156345068196448,0.10156345068196448,Empirical analysis of the correlation between the absence of a checking account and reduced credit default probability.,"Based on the provided context, the absence of a checking account demonstrates a clear negative association with credit risk, indicating a reduced probability of default. The empirical analysis explicitly notes that applicants categorized as having ""no checking account"" are associated with a lower estimated risk within the studied dataset. This finding suggests that, contrary to some conventional financial heuristics, lacking a checking account does not inherently increase default likelihood in this specific modeling framework. Instead, the variable functions as a risk-mitigating predictor in the regression analysis. While the provided text does not report a precise coefficient or p-value for this specific category, it confirms its statistical relevance by retaining it in the risk estimation model alongside other predictors like savings and age. Consequently, the data supports a direct inverse relationship between checking account absence and credit default probability. This underscores the necessity of dataset-specific empirical validation when interpreting the predictive direction of financial variables.

**Evidence Bullets:**
- ""No checking account"" category is explicitly associated with a lower estimated risk in the dataset (Source: regression-based credit risk modeling.pdf, p. 29).
- The variable demonstrates statistical relevance in the logistic/linear models, functioning as a risk-reducing predictor despite the absence of a reported coefficient or p-value (Source: regression-based credit risk modeling.pdf, p. 29).
- Its negative association aligns with other risk-mitigating predictors in the model, such as age, which also shows a statistically significant, modest negative association with credit risk (Source: regression-based credit risk modeling.pdf, p. 29).","[{""source"": ""regression-based credit risk modeling.pdf"", ""page"": 29, ""score"": 0.18870031833648682}, {""source"": ""regression-based credit risk modeling.pdf"", ""page"": 23, ""score"": 0.2032994031906128}, {""source"": ""An_Investigation_of_Credit_Card_Default_Prediction_in_the_Imbalanced_Datasets.pdf"", ""page"": 23, ""score"": 0.22997325658798218}, {""source"": ""The Application of Tree-based model to Unbalanced German Credit Data Analysis.pdf"", ""page"": 2, ""score"": 0.23082268238067627}, {""source"": ""DATA PREPARATION FOR DATA MINING BASED ON NEURAL NETWORK- A CASE STUDY ON GERMAN CREDIT CLASSIFICATION DATASET.pdf"", ""page"": 13, ""score"": 0.2333991527557373}]","[{""source"": ""regression-based credit risk modeling.pdf"", ""page"": 29, ""score"": 0.18870031833648682, ""sentence"": ""while the category of no checking account is associated with a lower estimated risk in this dataset.""}, {""source"": ""regression-based credit risk modeling.pdf"", ""page"": 23, ""score"": 0.2032994031906128, ""sentence"": ""The reduced model therefore retains only variables that demonstrate statistical relevance or clear theoretical importance in credit-risk modeling.""}, {""source"": ""An_Investigation_of_Credit_Card_Default_Prediction_in_the_Imbalanced_Datasets.pdf"", ""page"": 23, ""score"": 0.22997325658798218, ""sentence"": ""This low-productivity, signiﬁcant expense conjectures cannot meet consumer ﬁnance enterprise’s credit""}, {""source"": ""The Application of Tree-based model to Unbalanced German Credit Data Analysis.pdf"", ""page"": 2, ""score"": 0.23082268238067627, ""sentence"": ""However, there are two unique features in credit evaluation analysis.""}, {""source"": ""DATA PREPARATION FOR DATA MINING BASED ON NEURAL NETWORK- A CASE STUDY ON GERMAN CREDIT CLASSIFICATION DATASET.pdf"", ""page"": 13, ""score"": 0.2333991527557373, ""sentence"": ""between attributes, as exemplified by the correlation between the duration of loan and the credit amount.""}]","{""min_docs"": 3, ""max_docs"": 20, ""min_gap"": 0.001, ""max_chunks_per_source"": 2, ""inspect_all"": false}"
19,SHAP/Task/correct_102_local_shap/shap_tuples_non_prefix_19.json,GOOD CREDIT RISK,0.20826460898363966,2,checking_status_<0,Checking account status: balance below 0 DM.,decrease_risk,-0.04147652070146634,0.04147652070146634,Determinants of default: Investigating the risk mitigation effects of negative checking account balances on borrower creditworthiness.,"Based on the provided context, there is no direct evidence or statistical analysis regarding the impact of negative checking account balances on borrower creditworthiness or default probability. The text primarily addresses methodological challenges in credit risk prediction, such as class imbalance in default datasets and the limitations of traditional accounting-based models that rely on financial ratios, income accounts, and balance sheet data. While the context acknowledges that these traditional financial metrics are utilized to classify default versus non-default clients, it does not provide regression coefficients, p-values, or specific directional impacts for checking account balances. Furthermore, the research focuses on advanced machine learning approaches, including the Super Learner ensemble algorithm and Explainable AI, to improve prediction accuracy and model transparency rather than isolating individual financial determinants. Consequently, the provided excerpts do not support an analysis of how negative checking account balances mitigate or exacerbate credit risk. The available literature in this context emphasizes algorithmic performance and data preprocessing over specific account-level risk factors.

**Evidence Bullets:**
- Financial ratios, income accounts, and balance sheet data are utilized as traditional predictors to classify default versus non-default clients (Source: An_Investigation_of_Credit_Card_Default_Prediction_in_the_Imbalanced_Datasets.pdf, p. 2; Coefficient/Statistical Value: N/A)
- The context notes that these traditional accounting features are limited and may lead to model ineffectiveness, but provides no regression coefficients or p-values for checking account balances (Source: An_Investigation_of_Credit_Card_Default_Prediction_in_the_Imbalanced_Datasets.pdf, p. 2; Coefficient/Statistical Value: N/A)
- The Super Learner algorithm is employed to minimize weighted total classification loss across base classifiers, but individual predictor coefficients are not disclosed (Source: Personal Credit Default Discrimination Model Based on Super Learner.pdf, p. 3; Coefficient/Statistical Value: N/A)
- Model evaluation focuses on overall accuracy and explainability for credit risk decisions, with no statistical tables or coefficients provided for specific account-level determinants (Source: Explainable Automated Machine Learning for Credit Decisions.pdf, p. 6; Coefficient/Statistical Value: N/A)","[{""source"": ""An_Investigation_of_Credit_Card_Default_Prediction_in_the_Imbalanced_Datasets.pdf"", ""page"": 2, ""score"": 0.2037353515625}, {""source"": ""An_Investigation_of_Credit_Card_Default_Prediction_in_the_Imbalanced_Datasets.pdf"", ""page"": 2, ""score"": 0.20418649911880493}, {""source"": ""Explainable Automated Machine Learning for Credit Decisions.pdf"", ""page"": 6, ""score"": 0.21102279424667358}, {""source"": ""Personal Credit Default Discrimination Model Based on Super Learner.pdf"", ""page"": 3, ""score"": 0.21335607767105103}]","[{""source"": ""An_Investigation_of_Credit_Card_Default_Prediction_in_the_Imbalanced_Datasets.pdf"", ""page"": 2, ""score"": 0.2037353515625, ""sentence"": ""default client from non-defaulted [8] because these parame- ters may enhance the performance of models.""}, {""source"": ""An_Investigation_of_Credit_Card_Default_Prediction_in_the_Imbalanced_Datasets.pdf"", ""page"": 2, ""score"": 0.20418649911880493, ""sentence"": ""The stan- dard model depends on the ﬁnancial ratios, income account, and data on the balance sheet [6], [7].""}, {""source"": ""Explainable Automated Machine Learning for Credit Decisions.pdf"", ""page"": 6, ""score"": 0.21102279424667358, ""sentence"": ""Both accuracy and explainability are essential in aligning credit risk decisions with the dynamic demands o f the digital economy.""}, {""source"": ""Personal Credit Default Discrimination Model Based on Super Learner.pdf"", ""page"": 3, ""score"": 0.21335607767105103, ""sentence"": ""into the ﬁeld of default discrimination, based on mini- mizing the classiﬁcation loss, predicting the borrower’s creditstatus,andimprovingtheperformanceofpersonal creditdefaultdiscrimination.""}]","{""min_docs"": 3, ""max_docs"": 20, ""min_gap"": 0.001, ""max_chunks_per_source"": 2, ""inspect_all"": false}"
19,SHAP/Task/correct_102_local_shap/shap_tuples_non_prefix_19.json,GOOD CREDIT RISK,0.20826460898363966,3,savings_status_no known savings,Savings account status: no known savings account.,decrease_risk,-0.03465512574148601,0.03465512574148601,Credit risk drivers: Empirical evidence linking the lack of a formal savings account to lower default rates among retail borrowers.,"Based on the provided regression-based credit risk modeling context, the relationship between account status and credit risk requires careful distinction. The empirical data indicates that applicants with no checking account are actually associated with a lower estimated credit risk compared to the reference group. Conversely, regarding formal savings, lower savings categories are linked to a higher estimated risk of default. However, the statistical significance of these savings categories is mixed, as the analysis explicitly notes that not all savings levels demonstrate statistically significant differences. This suggests that while the absence of a checking account may signal lower risk in this specific dataset, lower savings balances generally trend toward higher risk, albeit with varying statistical confidence. Therefore, the evidence does not uniformly support the premise that lacking a formal savings account directly lowers default rates; instead, it highlights a nuanced relationship where checking account status and savings levels operate differently in risk assessment.

**Evidence Bullets:**
- ""No checking account"" category is associated with a lower estimated credit risk (Source: regression-based credit risk modeling.pdf, p. 29).
- Lower savings categories are associated with a higher estimated risk, though the analysis notes that not all savings levels show statistically significant differences (Source: regression-based credit risk modeling.pdf, p. 29).
- A checking account balance below 0 DM exhibits a substantially higher estimated risk relative to the reference group (Source: regression-based credit risk modeling.pdf, p. 29).","[{""source"": ""regression-based credit risk modeling.pdf"", ""page"": 29, ""score"": 0.20702087879180908}, {""source"": ""An_Investigation_of_Credit_Card_Default_Prediction_in_the_Imbalanced_Datasets.pdf"", ""page"": 2, ""score"": 0.2118133306503296}, {""source"": ""Explainable Automated Machine Learning for Credit Decisions.pdf"", ""page"": 6, ""score"": 0.21739965677261353}, {""source"": ""An_Investigation_of_Credit_Card_Default_Prediction_in_the_Imbalanced_Datasets.pdf"", ""page"": 4, ""score"": 0.21909308433532715}, {""source"": ""regression-based credit risk modeling.pdf"", ""page"": 29, ""score"": 0.21910518407821655}, {""source"": ""The Application of Tree-based model to Unbalanced German Credit Data Analysis.pdf"", ""page"": 2, ""score"": 0.22195100784301758}]","[{""source"": ""regression-based credit risk modeling.pdf"", ""page"": 29, ""score"": 0.20702087879180908, ""sentence"": ""while the category of no checking account is associated with a lower estimated risk in this dataset.""}, {""source"": ""An_Investigation_of_Credit_Card_Default_Prediction_in_the_Imbalanced_Datasets.pdf"", ""page"": 2, ""score"": 0.2118133306503296, ""sentence"": ""The performance of clas- siﬁers is compromised when good borrowers and defaulters have an imbalanced distribution of classes because classiﬁers""}, {""source"": ""Explainable Automated Machine Learning for Credit Decisions.pdf"", ""page"": 6, ""score"": 0.21739965677261353, ""sentence"": ""Both accuracy and explainability are essential in aligning credit risk decisions with the dynamic demands o f the digital economy.""}, {""source"": ""An_Investigation_of_Credit_Card_Default_Prediction_in_the_Imbalanced_Datasets.pdf"", ""page"": 4, ""score"": 0.21909308433532715, ""sentence"": ""T.""}, {""source"": ""regression-based credit risk modeling.pdf"", ""page"": 29, ""score"": 0.21910518407821655, ""sentence"": ""Applicants with a checking account balance below 0 DM (Deutsche Mark) exhibit a substantially higher estimated risk relative to the reference group, while the category of no checking account is associated with a lower estimated risk in this""}, {""source"": ""The Application of Tree-based model to Unbalanced German Credit Data Analysis.pdf"", ""page"": 2, ""score"": 0.22195100784301758, ""sentence"": ""and low-risk groups with the information like gender, age and savings account.""}]","{""min_docs"": 3, ""max_docs"": 20, ""min_gap"": 0.001, ""max_chunks_per_source"": 2, ""inspect_all"": false}"
