sample_idx,shap_json_path,prediction_label,prediction_probability,feature_rank,feature,feature_definition,feature_direction,feature_shap_value,feature_abs_shap,question,answer,selected_sources,evidence_sentences,retrieval_params
17,SHAP/Task/correct_102_local_shap/shap_tuples_non_prefix_17.json,GOOD CREDIT RISK,0.18616960226234006,1,checking_status_no checking,Checking account status: no checking account.,decrease_risk,-0.09257837248236513,0.09257837248236513,Empirical analysis of the risk-mitigating impact of lacking a checking account on borrower default probability.,"The provided context does not contain empirical regression results or statistical coefficients specifically analyzing the impact of lacking a checking account on borrower default probability. While the text emphasizes that lenders must carefully evaluate an applicant’s account status and credit history, it does not isolate the checking account variable or report its directional effect on credit risk. The available excerpts indicate that financial and credit-related characteristics generally exhibit stronger statistical associations with bad credit risk classifications than demographic factors. Additionally, one study notes the use of savings account information within tree-based models for the German Credit Dataset, but it does not provide regression coefficients or significance levels for checking account status. Traditional credit risk modeling in the context relies on financial ratios, income accounts, and balance sheet data to distinguish defaulters from non-defaulters, yet no specific variable coefficients are disclosed. Consequently, based strictly on the provided excerpts, there is insufficient statistical evidence to determine whether lacking a checking account increases, decreases, or mitigates default probability.

- Account status and credit history are identified as critical inspection points for classifying bad credit risk, though no specific coefficients or p-values are reported (Source: regression-based credit risk modeling.pdf, p. 29).
- Financial and credit-related variables show a stronger statistical association with default risk classifications compared to demographic characteristics (Source: regression-based credit risk modeling.pdf, p. 29).
- Savings account information is utilized in tree-based classification models for the German Credit Dataset, but regression coefficients and significance tests are not provided (Source: The Application of Tree-based model to Unbalanced German Credit Data Analysis.pdf, p. 2).
- Traditional credit risk models depend on financial ratios, income accounts, and balance sheet data to classify default versus non-default clients, without reporting specific variable impacts (Source: An_Investigation_of_Credit_Card_Default_Prediction_in_the_Imbalanced_Datasets.pdf, p. 2).","[{""source"": ""regression-based credit risk modeling.pdf"", ""page"": 6, ""score"": 0.19519197940826416}, {""source"": ""regression-based credit risk modeling.pdf"", ""page"": 29, ""score"": 0.2022092342376709}, {""source"": ""An_Investigation_of_Credit_Card_Default_Prediction_in_the_Imbalanced_Datasets.pdf"", ""page"": 2, ""score"": 0.20311897993087769}, {""source"": ""An_Investigation_of_Credit_Card_Default_Prediction_in_the_Imbalanced_Datasets.pdf"", ""page"": 2, ""score"": 0.20670533180236816}, {""source"": ""The Application of Tree-based model to Unbalanced German Credit Data Analysis.pdf"", ""page"": 2, ""score"": 0.20898205041885376}, {""source"": ""Explainable Automated Machine Learning for Credit Decisions.pdf"", ""page"": 6, ""score"": 0.21559739112854004}]","[{""source"": ""regression-based credit risk modeling.pdf"", ""page"": 6, ""score"": 0.19519197940826416, ""sentence"": ""In consumer and retail lending, this uncertainty is managed using credit and be- havioural scoring systems, which predict the probability that a borrower will default on their obligations (Thomas, 2000).""}, {""source"": ""regression-based credit risk modeling.pdf"", ""page"": 29, ""score"": 0.2022092342376709, ""sentence"": ""In practice, the results highlight the importance of lenders carefully inspecting the applicant’s account status, credit history, and the loan’s terms.""}, {""source"": ""An_Investigation_of_Credit_Card_Default_Prediction_in_the_Imbalanced_Datasets.pdf"", ""page"": 2, ""score"": 0.20311897993087769, ""sentence"": ""default client from non-defaulted [8] because these parame- ters may enhance the performance of models.""}, {""source"": ""An_Investigation_of_Credit_Card_Default_Prediction_in_the_Imbalanced_Datasets.pdf"", ""page"": 2, ""score"": 0.20670533180236816, ""sentence"": ""The stan- dard model depends on the ﬁnancial ratios, income account, and data on the balance sheet [6], [7].""}, {""source"": ""The Application of Tree-based model to Unbalanced German Credit Data Analysis.pdf"", ""page"": 2, ""score"": 0.20898205041885376, ""sentence"": ""However, there are two unique features in credit evaluation analysis.""}, {""source"": ""Explainable Automated Machine Learning for Credit Decisions.pdf"", ""page"": 6, ""score"": 0.21559739112854004, ""sentence"": ""Both accuracy and explainability are essential in aligning credit risk decisions with the dynamic demands o f the digital economy.""}]","{""min_docs"": 3, ""max_docs"": 20, ""min_gap"": 0.001, ""max_chunks_per_source"": 2, ""inspect_all"": false}"
17,SHAP/Task/correct_102_local_shap/shap_tuples_non_prefix_17.json,GOOD CREDIT RISK,0.18616960226234006,2,credit_history_critical/other existing credit,Credit history: critical account or other existing credits.,decrease_risk,-0.05661214969758954,0.05661214969758954,Determinants of default: The influence of critical or alternative existing credit histories on reducing overall credit risk.,"Based on the provided context, existing credit history is established as a statistically significant determinant of default probability and credit risk classification. The text explicitly identifies ""Credit history"" and ""repayment history"" as central financial characteristics that play a pivotal role in distinguishing between defaulted and non-defaulted clients. While the context confirms that credit history is a critical predictor alongside variables like duration and credit amount, it does not provide specific regression coefficients or p-values to quantify whether it positively or negatively impacts the likelihood of default. In contrast, the analysis explicitly notes that longer loan durations and higher credit amounts are positively associated with increased credit risk. Financial characteristics, including credit history, are consistently highlighted as having a stronger influence on risk classification than demographic variables. Therefore, while credit history is undeniably a key indicator in predictive modeling, the provided excerpts do not specify its directional effect (i.e., whether it reduces or increases risk) or its exact statistical magnitude.

**Evidence Bullets:**
- Credit history is listed as a significant predictor with a confirmed role in credit risk classification models (Source: regression-based credit risk modeling.pdf, p. 28).
- Repayment history and financial characteristics are emphasized as central indicators for default classification, demonstrating a stronger influence on risk classification than demographic variables (Source: regression-based credit risk modeling.pdf, p. 28).
- Duration and Credit amount are explicitly identified as key risk indicators that positively increase the likelihood of credit risk (Source: regression-based credit risk modeling.pdf, p. 23).","[{""source"": ""An_Investigation_of_Credit_Card_Default_Prediction_in_the_Imbalanced_Datasets.pdf"", ""page"": 2, ""score"": 0.18634247779846191}, {""source"": ""An_Investigation_of_Credit_Card_Default_Prediction_in_the_Imbalanced_Datasets.pdf"", ""page"": 1, ""score"": 0.1927909255027771}, {""source"": ""Explainable Automated Machine Learning for Credit Decisions.pdf"", ""page"": 6, ""score"": 0.19484180212020874}, {""source"": ""regression-based credit risk modeling.pdf"", ""page"": 23, ""score"": 0.1970832347869873}, {""source"": ""regression-based credit risk modeling.pdf"", ""page"": 28, ""score"": 0.1985873579978943}]","[{""source"": ""An_Investigation_of_Credit_Card_Default_Prediction_in_the_Imbalanced_Datasets.pdf"", ""page"": 2, ""score"": 0.18634247779846191, ""sentence"": ""The stan- dard model depends on the ﬁnancial ratios, income account, and data on the balance sheet [6], [7].""}, {""source"": ""An_Investigation_of_Credit_Card_Default_Prediction_in_the_Imbalanced_Datasets.pdf"", ""page"": 1, ""score"": 0.1927909255027771, ""sentence"": ""ﬁnancial organizations, loan institutes, and other decision-makers to predict the loan defaulter earlier.""}, {""source"": ""Explainable Automated Machine Learning for Credit Decisions.pdf"", ""page"": 6, ""score"": 0.19484180212020874, ""sentence"": ""Both accuracy and explainability are essential in aligning credit risk decisions with the dynamic demands o f the digital economy.""}, {""source"": ""regression-based credit risk modeling.pdf"", ""page"": 23, ""score"": 0.1970832347869873, ""sentence"": ""financial capacity and credit history, such asDuration,Credit amount,Installment rate, and various levels ofStatusandPurposeas key risk indicators.""}, {""source"": ""regression-based credit risk modeling.pdf"", ""page"": 28, ""score"": 0.1985873579978943, ""sentence"": ""The significant roles of credit-related and financial characteristics,Duration,Credit amount,Checking account status, andCredit historyin the models here align with that evidence. Özdemir (2008) finds that financial variables have a stronger influence on risk classification than demographic variables, which is consistent with the findings of this study.""}]","{""min_docs"": 3, ""max_docs"": 20, ""min_gap"": 0.001, ""max_chunks_per_source"": 2, ""inspect_all"": false}"
17,SHAP/Task/correct_102_local_shap/shap_tuples_non_prefix_17.json,GOOD CREDIT RISK,0.18616960226234006,3,duration,Loan duration in months.,decrease_risk,-0.05443547303403653,0.05443547303403653,Credit risk drivers: An empirical investigation into how extended loan duration correlates with decreased borrower default probability.,"Based on the provided context, extended loan duration is positively associated with credit risk, directly contradicting the premise that it correlates with decreased default probability. The regression analysis explicitly identifies Duration as a key risk indicator, with empirical findings confirming that longer loan durations increase the likelihood of credit risk. This positive relationship aligns with theoretical expectations, as borrowers with extended repayment periods face a higher cumulative probability of encountering financial difficulties over time. The ordinary least squares (OLS) framework treats Duration as a statistically meaningful predictor, reinforcing its role in descriptive credit risk benchmarking. Consequently, rather than reducing default probability, extended duration serves as a risk-enhancing factor in this modeling context. Financial institutions should therefore account for longer tenures as a positive risk driver when calibrating credit scoring models.

**Evidence Bullets:**
- Duration is positively associated with credit risk, as longer durations increase the likelihood of default (Source: regression-based credit risk modeling.pdf, p. 23).
- Duration is explicitly listed as a key risk indicator in the reduced OLS regression model, confirming its statistical significance as a positive predictor (Source: regression-based credit risk modeling.pdf, p. 23).
- The empirical findings indicate that extended loan terms act as a risk-enhancing factor rather than a protective one, contradicting the premise of decreased default probability (Source: regression-based credit risk modeling.pdf, p. 23).","[{""source"": ""regression-based credit risk modeling.pdf"", ""page"": 23, ""score"": 0.18425363302230835}, {""source"": ""regression-based credit risk modeling.pdf"", ""page"": 7, ""score"": 0.1875494122505188}, {""source"": ""An_Investigation_of_Credit_Card_Default_Prediction_in_the_Imbalanced_Datasets.pdf"", ""page"": 1, ""score"": 0.1977313756942749}]","[{""source"": ""regression-based credit risk modeling.pdf"", ""page"": 23, ""score"": 0.18425363302230835, ""sentence"": ""These findings confirm that the reduced model serves as an effective descriptive benchmark.""}, {""source"": ""regression-based credit risk modeling.pdf"", ""page"": 7, ""score"": 0.1875494122505188, ""sentence"": ""Empirical work has exam- ined how demographic characteristics, such as age and marital status, and loan terms, such as loan size and interest rate, affect the borrower’s ability to repay on time (Özdemir, 2008).""}, {""source"": ""An_Investigation_of_Credit_Card_Default_Prediction_in_the_Imbalanced_Datasets.pdf"", ""page"": 1, ""score"": 0.1977313756942749, ""sentence"": ""ﬁnancial organizations, loan institutes, and other decision-makers to predict the loan defaulter earlier.""}]","{""min_docs"": 3, ""max_docs"": 20, ""min_gap"": 0.001, ""max_chunks_per_source"": 2, ""inspect_all"": false}"
