sample_idx,shap_json_path,prediction_label,prediction_probability,feature_rank,feature,feature_definition,feature_direction,feature_shap_value,feature_abs_shap,question,answer,selected_sources,evidence_sentences,retrieval_params
117,SHAP/All Dataset Local Shap/shap_tuples_non_prefix_117.json,GOOD CREDIT RISK,0.36637511524070354,1,duration,Loan duration in months.,decrease_risk,-0.0778719914713039,0.0778719914713039,Empirical analysis of loan duration in months as a determinant of decreased credit default probability.,"Based on the provided context, empirical analysis demonstrates that loan duration has a positive relationship with credit risk, directly contradicting the premise that it decreases default probability. The regression-based modeling explicitly identifies duration as a key risk indicator, where longer loan terms are associated with an increased likelihood of credit risk. This directional impact aligns with theoretical expectations in credit scoring literature, which posit that extended repayment periods elevate the probability of borrower default due to prolonged exposure to financial instability and shifting economic conditions. The ordinary least squares (OLS) analysis confirms duration as a statistically relevant predictor alongside financial variables like credit amount and installment rate. Consequently, rather than mitigating default probability, longer durations empirically contribute to higher credit risk in the analyzed datasets.

Evidence Bullets:
- Duration (direction: positive, specific coefficient not explicitly reported in text) is positively associated with increased credit risk (Source: regression-based credit risk modeling.pdf, page 23).
- The OLS regression analysis confirms duration as a significant predictor of borrower default probability, serving as an interpretable baseline model for risk assessment (Source: regression-based credit risk modeling.pdf, page 23).
- The positive association between loan duration and credit risk aligns with theoretical expectations regarding extended repayment terms and borrower financial capacity (Source: regression-based credit risk modeling.pdf, page 23).","[{""source"": ""An_Investigation_of_Credit_Card_Default_Prediction_in_the_Imbalanced_Datasets.pdf"", ""page"": 2, ""score"": 0.17713677883148193}, {""source"": ""regression-based credit risk modeling.pdf"", ""page"": 23, ""score"": 0.17792892456054688}, {""source"": ""regression-based credit risk modeling.pdf"", ""page"": 7, ""score"": 0.17820817232131958}]","[{""source"": ""An_Investigation_of_Credit_Card_Default_Prediction_in_the_Imbalanced_Datasets.pdf"", ""page"": 2, ""score"": 0.17713677883148193, ""sentence"": ""The delinquency rate indicates the percentage of past-due loans within the bor- rower’s entire loan portfolio.""}, {""source"": ""regression-based credit risk modeling.pdf"", ""page"": 23, ""score"": 0.17792892456054688, ""sentence"": ""OLS also lays a solid foundation for Tikhonov regularization and logistic regression analysis.""}, {""source"": ""regression-based credit risk modeling.pdf"", ""page"": 7, ""score"": 0.17820817232131958, ""sentence"": ""Empirical work has exam- ined how demographic characteristics, such as age and marital status, and loan terms, such as loan size and interest rate, affect the borrower’s ability to repay on time (Özdemir, 2008).""}]","{""min_docs"": 3, ""max_docs"": 20, ""min_gap"": 0.001, ""max_chunks_per_source"": 2, ""inspect_all"": false}"
117,SHAP/All Dataset Local Shap/shap_tuples_non_prefix_117.json,GOOD CREDIT RISK,0.36637511524070354,2,credit_history_critical/other existing credit,Credit history: critical account or other existing credits.,decrease_risk,-0.06311926889330755,0.06311926889330755,Investigation of credit history regarding critical accounts or other existing credits as drivers of reduced credit risk.,"Based on the provided context, the variable `A34: critical account/other credits existing (not at this bank)` is explicitly cataloged as a dataset feature, but the regression analysis excerpts do not report specific coefficients, p-values, or directional impacts for it. The statistical modeling results instead identify `Duration`, `Credit amount`, `Installment rate`, and categorical levels of `Status` and `Purpose` as the key predictors retained in the reduced model. These retained variables demonstrate a positive relationship with credit risk, confirming that longer loan durations and higher credit amounts increase the likelihood of default. Conversely, credit history-related variables such as ""Number of credits"" were explicitly removed from the OLS specification because they failed to demonstrate statistical relevance or clear theoretical importance. Consequently, the provided text does not support the premise that critical accounts or other existing credits act as drivers of reduced credit risk. The significant predictors identified in the analysis are associated with increased risk, while the excluded credit history variables did not meet the model's statistical significance thresholds.

**Evidence Bullets:**
• A34 (critical account/other credits existing) is listed as a dataset variable but lacks reported regression coefficients or significance values in the provided excerpts (Source: DATA PREPARATION FOR DATA MINING BASED ON NEURAL NETWORK- A CASE STUDY ON GERMAN CREDIT CLASSIFICATION DATASET.pdf, p. 5).
• Duration and Credit amount are positively associated with credit risk, with the analysis explicitly stating that longer durations and higher amounts increase the likelihood of default (Source: regression-based credit risk modeling.pdf, p. 23).
• Variables including ""Number of credits"" were removed from the reduced OLS model due to insufficient statistical relevance, leaving the model with an Adjusted R² of 0.22 (Source: regression-based credit risk modeling.pdf, p. 23).
• The final regression specification retains only predictors that significantly explain risk, focusing on financial capacity indicators rather than credit history variables like critical accounts (Source: regression-based credit risk modeling.pdf, p. 23).","[{""source"": ""DATA PREPARATION FOR DATA MINING BASED ON NEURAL NETWORK- A CASE STUDY ON GERMAN CREDIT CLASSIFICATION DATASET.pdf"", ""page"": 5, ""score"": 0.17882949113845825}, {""source"": ""regression-based credit risk modeling.pdf"", ""page"": 23, ""score"": 0.18169808387756348}, {""source"": ""regression-based credit risk modeling.pdf"", ""page"": 23, ""score"": 0.1840631365776062}]","[{""source"": ""DATA PREPARATION FOR DATA MINING BASED ON NEURAL NETWORK- A CASE STUDY ON GERMAN CREDIT CLASSIFICATION DATASET.pdf"", ""page"": 5, ""score"": 0.17882949113845825, ""sentence"": ""• A32 : existing credits paid back duly till now • A 3 3: delay in paying off in the past • A34 : critical account/other credits existing (not at this bank), o Attribut e 4: purpose • A40 : car (new) • A46 : education • A41 : car (used) • A47 : vacation • A42 : furniture/equipment • A48 : retraining • A43 : radio/television • A49 : business • A44 : domestic appliances • A410 : others • A45 : repairs o Attribut e 5: credit amount o Attribut e 6: savings account/bonds • A61 : .. . < 10 0 DM 135""}, {""source"": ""regression-based credit risk modeling.pdf"", ""page"": 23, ""score"": 0.18169808387756348, ""sentence"": ""PredictorsPresent residence,Number of credits,People liableandTelephoneas well as dummy-encoded categorical groupsPersonal status,Other installment plans,Housing,Prop- erty,JobandSavingswere removed.""}, {""source"": ""regression-based credit risk modeling.pdf"", ""page"": 23, ""score"": 0.1840631365776062, ""sentence"": ""These findings confirm that the reduced model serves as an effective descriptive benchmark.""}]","{""min_docs"": 3, ""max_docs"": 20, ""min_gap"": 0.001, ""max_chunks_per_source"": 2, ""inspect_all"": false}"
117,SHAP/All Dataset Local Shap/shap_tuples_non_prefix_117.json,GOOD CREDIT RISK,0.36637511524070354,3,savings_status_no known savings,Savings account status: no known savings account.,decrease_risk,-0.04545011991872763,0.04545011991872763,Statistical impact of savings account status indicating no known savings account on the mitigation of credit risk.,"Based on the provided context, the savings account status indicating no known savings does not mitigate credit risk; instead, it is associated with an increase in estimated default probability. The excerpt explicitly states that lower savings categories correlate with higher estimated risk when compared to a reference category. This indicates a positive relationship between reduced savings and elevated credit risk, directly contradicting the premise that such a status mitigates risk. Regarding statistical significance, the authors note that while savings are informative predictors, not all specific savings levels demonstrate statistically significant differences in their impact on risk estimation. Consequently, an applicant with no known savings would likely fall into the lowest savings tier, which the model associates with greater rather than reduced financial vulnerability. Financial institutions interpreting these results should treat the absence of savings as a risk-amplifying factor rather than a protective one.

**Evidence Bullets:**
- Lower savings categories (including no known savings) are positively associated with higher estimated credit risk, though not all levels reach statistical significance (Source: regression-based credit risk modeling.pdf, page 29).
- The directional impact contradicts risk mitigation, as reduced savings correlate with increased default probability rather than a decrease (Source: regression-based credit risk modeling.pdf, page 29).
- No exact regression coefficient or p-value is provided in the excerpt for the specific ""no savings"" tier, but the qualitative regression results confirm a risk-increasing effect (Source: regression-based credit risk modeling.pdf, page 29).","[{""source"": ""How much do we see? On the explainability of partial dependence plots for credit risk scoring.pdf"", ""page"": 10, ""score"": 0.2353590726852417}, {""source"": ""regression-based credit risk modeling.pdf"", ""page"": 29, ""score"": 0.2430981993675232}, {""source"": ""Explainable Automated Machine Learning for Credit Decisions.pdf"", ""page"": 5, ""score"": 0.2669123411178589}]","[{""source"": ""How much do we see? On the explainability of partial dependence plots for credit risk scoring.pdf"", ""page"": 10, ""score"": 0.2353590726852417, ""sentence"": ""2D PDP for the variables status account and duration.""}, {""source"": ""regression-based credit risk modeling.pdf"", ""page"": 29, ""score"": 0.2430981993675232, ""sentence"": ""Savings are also informative.""}, {""source"": ""Explainable Automated Machine Learning for Credit Decisions.pdf"", ""page"": 5, ""score"": 0.2669123411178589, ""sentence"": ""SHAP values assess the impact of individual features, such as credit amount, employment status, and payment history, on credit decisions.""}]","{""min_docs"": 3, ""max_docs"": 20, ""min_gap"": 0.001, ""max_chunks_per_source"": 2, ""inspect_all"": false}"
