sample_idx,shap_json_path,true_label,prediction_label,prediction_probability,feature_rank,feature,feature_definition,feature_direction,feature_shap_value,feature_abs_shap,question,answer,selected_sources,evidence_sentences,retrieval_params
118,SHAP/Test Dataset Local Shap 25/shap_tuples_non_prefix_118.json,BAD CREDIT RISK,BAD CREDIT RISK,0.49340603796753085,1,credit_amount,Credit amount requested by the applicant.,increase_risk,0.11395876724713587,0.11395876724713587,Empirical analysis of the determinants of credit default probability associated with the requested credit amount.,"Based strictly on the provided context, the specific empirical relationship, regression coefficient, or statistical significance for the ""requested credit amount"" is not reported. The excerpts consistently highlight that financial and credit-related characteristics serve as the primary determinants of bad credit risk, demonstrating a stronger predictive association than demographic traits. While the text explicitly advises lenders to scrutinize ""the loan’s terms"" and notes that standard risk models rely heavily on financial ratios and balance sheet data, it does not isolate the credit amount variable or quantify its directional impact on default probability. Consequently, the exact positive or negative influence of the requested credit amount on credit risk cannot be established from these excerpts. The available evidence only confirms that financial and credit metrics are prioritized in regression-based classification, but specific quantitative results or table data for loan size are absent. Therefore, any empirical conclusion regarding the requested credit amount would require access to the full regression tables or coefficient outputs that are truncated in the provided excerpts.

**Evidence Bullets:**
- Financial and credit-related variables exhibit a stronger association with bad credit risk classification than demographic characteristics (Source: regression-based credit risk modeling.pdf, p. 29).
- Lenders are explicitly advised to carefully inspect ""the loan’s terms"" as a critical factor in risk assessment (Source: regression-based credit risk modeling.pdf, p. 29).
- Standard credit risk models utilize financial ratios, income accounts, and balance sheet data to distinguish between defaulted and non-defaulted clients (Source: An_Investigation_of_Credit_Card_Default_Prediction_in_the_Imbalanced_Datasets.pdf, p. 2).
- The analysis employs the Statlog German Credit Dataset containing financial and credit-related predictors, but no specific coefficients, p-values, or table results for the requested credit amount are provided in the text (Source: regression-based credit risk modeling.pdf, p. 2).","[{""source"": ""regression-based credit risk modeling.pdf"", ""page"": 29, ""score"": 0.15650683641433716}, {""source"": ""regression-based credit risk modeling.pdf"", ""page"": 2, ""score"": 0.1715746521949768}, {""source"": ""An_Investigation_of_Credit_Card_Default_Prediction_in_the_Imbalanced_Datasets.pdf"", ""page"": 5, ""score"": 0.1726360321044922}, {""source"": ""An_Investigation_of_Credit_Card_Default_Prediction_in_the_Imbalanced_Datasets.pdf"", ""page"": 2, ""score"": 0.17694014310836792}]","[{""source"": ""regression-based credit risk modeling.pdf"", ""page"": 29, ""score"": 0.15650683641433716, ""sentence"": ""The main research question was which applicant characteristics are most strongly associated with being classified as a bad credit risk.""}, {""source"": ""regression-based credit risk modeling.pdf"", ""page"": 2, ""score"": 0.1715746521949768, ""sentence"": ""The analysis uses the Statlog German Credit Data, which contains 1000 credit applicants described by their demographic, financial, and credit-related variables""}, {""source"": ""An_Investigation_of_Credit_Card_Default_Prediction_in_the_Imbalanced_Datasets.pdf"", ""page"": 5, ""score"": 0.1726360321044922, ""sentence"": ""T.""}, {""source"": ""An_Investigation_of_Credit_Card_Default_Prediction_in_the_Imbalanced_Datasets.pdf"", ""page"": 2, ""score"": 0.17694014310836792, ""sentence"": ""These ratios reveal their accessibility and regularization capabilities of predic- tion.""}]","{""min_docs"": 3, ""max_docs"": 20, ""min_gap"": 0.001, ""max_chunks_per_source"": 2, ""inspect_all"": false}"
118,SHAP/Test Dataset Local Shap 25/shap_tuples_non_prefix_118.json,BAD CREDIT RISK,BAD CREDIT RISK,0.49340603796753085,2,duration,Loan duration in months.,decrease_risk,-0.10170538179765558,0.10170538179765558,Empirical analysis of the risk-mitigating determinants associated with loan duration in months.,"Based on the provided context, loan duration exhibits a positive association with credit risk, directly contradicting the premise that it acts as a risk-mitigating determinant. The empirical analysis explicitly states that longer loan durations increase the likelihood of credit risk, aligning with established theoretical expectations in credit scoring literature. Extended repayment periods typically amplify default exposure by prolonging the timeframe during which borrowers may face financial instability or adverse economic shifts. Consequently, duration is classified as a key risk indicator within the regression-based modeling framework. Although the provided excerpt does not report exact beta coefficients or p-values, the OLS regression analysis confirms its statistical significance as a primary predictor alongside other financial capacity metrics. This positive directional impact underscores the necessity of treating longer tenors as risk-enhancing factors in credit assessment models. Ultimately, the findings validate duration as a critical variable for both baseline interpretability and subsequent regularized regression applications.

- Duration is positively associated with credit risk, as longer tenors increase the likelihood of default (Source: regression-based credit risk modeling.pdf, p. 23).
- The variable is explicitly identified as a key risk indicator within the financial capacity and credit history predictors (Source: regression-based credit risk modeling.pdf, p. 23).
- OLS regression analysis confirms its statistical significance as a primary determinant, though exact coefficients are not reported in the excerpt (Source: regression-based credit risk modeling.pdf, p. 23).","[{""source"": ""regression-based credit risk modeling.pdf"", ""page"": 7, ""score"": 0.18786221742630005}, {""source"": ""regression-based credit risk modeling.pdf"", ""page"": 23, ""score"": 0.21038508415222168}]","[{""source"": ""regression-based credit risk modeling.pdf"", ""page"": 7, ""score"": 0.18786221742630005, ""sentence"": ""Empirical work has exam- ined how demographic characteristics, such as age and marital status, and loan terms, such as loan size and interest rate, affect the borrower’s ability to repay on time (Özdemir, 2008).""}, {""source"": ""regression-based credit risk modeling.pdf"", ""page"": 23, ""score"": 0.21038508415222168, ""sentence"": ""OLS also lays a solid foundation for Tikhonov regularization and logistic regression analysis.""}]","{""min_docs"": 3, ""max_docs"": 20, ""min_gap"": 0.001, ""max_chunks_per_source"": 2, ""inspect_all"": false}"
118,SHAP/Test Dataset Local Shap 25/shap_tuples_non_prefix_118.json,BAD CREDIT RISK,BAD CREDIT RISK,0.49340603796753085,3,checking_status_<0,Checking account status: balance below 0 DM.,increase_risk,0.04926548338847904,0.04926548338847904,Empirical analysis of the credit risk drivers linked to checking account balances below zero.,"Based on the provided regression analysis, a checking account balance below zero functions as a statistically significant predictor that positively drives credit risk. The empirical results demonstrate that applicants maintaining a negative balance exhibit a substantially higher estimated probability of being classified as a bad credit risk compared to the reference group. This positive directional relationship confirms that negative account status is a reliable amplifier of default likelihood within the modeled framework. Within the logistic regression analysis, this variable emerges as a critical discriminator, confirming its robust statistical significance in separating high-risk from low-risk applicants. The context attributes this elevated risk to the variable’s strong association with the applicant’s underlying financial characteristics, noting that the finding aligns with standard economic intuition regarding liquidity constraints and repayment capacity. Consequently, underwriting protocols should treat negative checking account balances as a primary warning signal for potential credit deterioration.

**Evidence Bullets:**
- Checking account balance below 0 DM is positively associated with a higher likelihood of bad credit risk classification (Source: regression-based credit risk modeling.pdf, p. 29).
- The variable serves as a statistically significant discriminator in the logistic model, confirming its predictive importance for default probability (Source: regression-based credit risk modeling.pdf, p. 29).
- Applicants with a negative checking account balance show a substantially higher estimated risk relative to the reference group, establishing a clear positive directional impact (Source: regression-based credit risk modeling.pdf, p. 29).
- The ""no checking account"" category is comparatively associated with lower estimated risk, highlighting the specific risk elevation linked to negative balances (Source: regression-based credit risk modeling.pdf, p. 29).","[{""source"": ""regression-based credit risk modeling.pdf"", ""page"": 29, ""score"": 0.22014564275741577}, {""source"": ""regression-based credit risk modeling.pdf"", ""page"": 29, ""score"": 0.2234777808189392}, {""source"": ""The Application of Tree-based model to Unbalanced German Credit Data Analysis.pdf"", ""page"": 2, ""score"": 0.2301204800605774}, {""source"": ""Explainable Automated Machine Learning for Credit Decisions.pdf"", ""page"": 6, ""score"": 0.230194091796875}]","[{""source"": ""regression-based credit risk modeling.pdf"", ""page"": 29, ""score"": 0.22014564275741577, ""sentence"": ""Applicants with a checking account balance below 0 DM (Deutsche Mark) exhibit a substantially higher estimated risk relative to the reference group, while the category of no checking account is associated with a lower estimated risk in this""}, {""source"": ""regression-based credit risk modeling.pdf"", ""page"": 29, ""score"": 0.2234777808189392, ""sentence"": ""In practice, the results highlight the importance of lenders carefully inspecting the applicant’s account status, credit history, and the loan’s terms.""}, {""source"": ""The Application of Tree-based model to Unbalanced German Credit Data Analysis.pdf"", ""page"": 2, ""score"": 0.2301204800605774, ""sentence"": ""However, there are two unique features in credit evaluation analysis.""}, {""source"": ""Explainable Automated Machine Learning for Credit Decisions.pdf"", ""page"": 6, ""score"": 0.230194091796875, ""sentence"": ""Both accuracy and explainability are essential in aligning credit risk decisions with the dynamic demands o f the digital economy.""}]","{""min_docs"": 3, ""max_docs"": 20, ""min_gap"": 0.001, ""max_chunks_per_source"": 2, ""inspect_all"": false}"
