sample_idx,shap_json_path,prediction_label,prediction_probability,feature_rank,feature,feature_definition,feature_direction,feature_shap_value,feature_abs_shap,question,answer,selected_sources,evidence_sentences,retrieval_params
168,SHAP/Test Dataset Local Shap 25/shap_tuples_non_prefix_168.json,UNKNOWN,UNKNOWN,1,checking_status_no checking,Checking account status: no checking account.,increase_risk,0.05004394103768136,0.05004394103768136,Empirical analysis of the impact of lacking a checking account on credit default probability and its role as a credit risk driver.,"Based strictly on the provided context, the specific variable ""lacking a checking account"" is not explicitly isolated or assigned a regression coefficient. However, the text identifies ""various levels of Status"" alongside financial capacity metrics as key risk indicators in the reduced model. While the excerpt does not provide the exact directional coefficient or p-value for checking account status, it explicitly confirms that continuous financial capacity variables, specifically Duration and Credit Amount, have a positive impact on credit risk. This means that longer loan terms and larger loan sizes empirically increase the likelihood of default. The OLS analysis utilized in the study functions primarily as an interpretable baseline to explain predictor relationships and detect multicollinearity before advancing to regularized and logistic regression models. Consequently, although ""Status"" is empirically grouped with other significant risk drivers, the provided text does not quantify its individual directional effect on default probability. The analysis emphasizes that reliable historical data and financial capacity metrics are essential for building predictive credit risk models, particularly in contexts with constrained banking records.

**Evidence Bullets:**
- ""Status"" is listed as a key risk indicator alongside financial capacity metrics, though no specific coefficient or p-value is provided for its individual impact (Source: regression-based credit risk modeling.pdf, p. 23).
- Duration and Credit Amount are explicitly noted as having a positive association with credit risk, as longer durations and higher amounts increase the likelihood of default (Source: regression-based credit risk modeling.pdf, p. 23).
- The OLS baseline model is utilized to identify relevant predictors and detect multicollinearity, establishing a foundation for subsequent logistic regression analysis of default probability (Source: regression-based credit risk modeling.pdf, p. 23).
- The study highlights that constrained banking records and lack of property data necessitate reliable historical credit information to accurately predict default in imbalanced datasets (Source: An_Investigation_of_Credit_Card_Default_Prediction_in_the_Imbalanced_Datasets.pdf, p. 23).","[{""source"": ""regression-based credit risk modeling.pdf"", ""page"": 23, ""score"": 0.19554316997528076}, {""source"": ""regression-based credit risk modeling.pdf"", ""page"": 23, ""score"": 0.195725679397583}, {""source"": ""An_Investigation_of_Credit_Card_Default_Prediction_in_the_Imbalanced_Datasets.pdf"", ""page"": 23, ""score"": 0.20351171493530273}, {""source"": ""An_Investigation_of_Credit_Card_Default_Prediction_in_the_Imbalanced_Datasets.pdf"", ""page"": 23, ""score"": 0.2035534381866455}]","[{""source"": ""regression-based credit risk modeling.pdf"", ""page"": 23, ""score"": 0.19554316997528076, ""sentence"": ""OLS also lays a solid foundation for Tikhonov regularization and logistic regression analysis.""}, {""source"": ""regression-based credit risk modeling.pdf"", ""page"": 23, ""score"": 0.195725679397583, ""sentence"": ""OLS also lays a solid foundation for Tikhonov regularization and logistic regression analysis.""}, {""source"": ""An_Investigation_of_Credit_Card_Default_Prediction_in_the_Imbalanced_Datasets.pdf"", ""page"": 23, ""score"": 0.20351171493530273, ""sentence"": ""This low-productivity, signiﬁcant expense conjectures cannot meet consumer ﬁnance enterprise’s credit""}, {""source"": ""An_Investigation_of_Credit_Card_Default_Prediction_in_the_Imbalanced_Datasets.pdf"", ""page"": 23, ""score"": 0.2035534381866455, ""sentence"": ""This low-productivity, signiﬁcant expense conjectures cannot meet consumer ﬁnance enterprise’s credit""}]","{""min_docs"": 3, ""max_docs"": 20, ""min_gap"": 0.001, ""max_chunks_per_source"": 2, ""inspect_all"": false}"
168,SHAP/Test Dataset Local Shap 25/shap_tuples_non_prefix_168.json,UNKNOWN,UNKNOWN,2,credit_history_no credits/all paid,Credit history: no credits taken or all previous credits paid back duly.,increase_risk,0.044835102804329195,0.044835102804329195,Determinants of default associated with borrowers having no prior credit history or exclusively fully repaid loans and their contribution to increased credit risk.,"Based strictly on the provided context, it is not possible to determine the directional impact or statistical significance of borrowers with no prior credit history or exclusively fully repaid loans on credit risk. The provided excerpt consists solely of the title page and metadata for a study titled ""An Investigation of Credit Card Default Prediction in the Imbalanced Datasets."" While the index terms confirm that the broader research focuses on ""customer credit risk,"" ""credit card default model,"" and interpretable machine learning techniques like gradient boosted decision trees, the text does not contain any regression tables, coefficient estimates, p-values, or variable-level analysis. Consequently, no positive or negative relationships can be established for the specific determinants mentioned in the question from this excerpt alone. To accurately assess how prior credit history or loan repayment status influences default probability, one would need to consult the full manuscript, particularly the empirical results or feature importance sections where such statistical relationships are typically quantified. The current metadata only indicates the paper’s methodological scope rather than its empirical findings regarding borrower characteristics.

**Evidence Bullets:**
- The provided context (Source: An_Investigation_of_Credit_Card_Default_Prediction_in_the_Imbalanced_Datasets.pdf, p. 1) contains only title page metadata and index terms, with no regression coefficients, p-values, or variable-specific risk directions reported.
- Index terms on page 1 confirm the study’s focus on ""customer credit risk"" and ""credit card default model"" using interpretable machine learning, but do not quantify the impact of prior credit history or repayment status.
- No statistical tables, feature importance scores, or determinant analyses are included in the excerpt, making it impossible to assign a positive or negative coefficient to the requested variables.
- The methodological focus on ""gradient boosted decision tree"" and ""imbalanced data"" (Source: An_Investigation_of_Credit_Card_Default_Prediction_in_the_Imbalanced_Datasets.pdf, p. 1) suggests that variable contributions would be evaluated through model interpretability rather than traditional regression coefficients, but these results are absent from the provided text.","[{""source"": ""An_Investigation_of_Credit_Card_Default_Prediction_in_the_Imbalanced_Datasets.pdf"", ""page"": 1, ""score"": 0.18725216388702393}, {""source"": ""An_Investigation_of_Credit_Card_Default_Prediction_in_the_Imbalanced_Datasets.pdf"", ""page"": 1, ""score"": 0.18731367588043213}]","[{""source"": ""An_Investigation_of_Credit_Card_Default_Prediction_in_the_Imbalanced_Datasets.pdf"", ""page"": 1, ""score"": 0.18725216388702393, ""sentence"": ""For more information, see https://creativecommons.org/licenses/by/4.0/ 201173""}, {""source"": ""An_Investigation_of_Credit_Card_Default_Prediction_in_the_Imbalanced_Datasets.pdf"", ""page"": 1, ""score"": 0.18731367588043213, ""sentence"": ""For more information, see https://creativecommons.org/licenses/by/4.0/ 201173""}]","{""min_docs"": 3, ""max_docs"": 20, ""min_gap"": 0.001, ""max_chunks_per_source"": 2, ""inspect_all"": false}"
168,SHAP/Test Dataset Local Shap 25/shap_tuples_non_prefix_168.json,UNKNOWN,UNKNOWN,3,duration,Loan duration in months.,increase_risk,0.043437574470582434,0.043437574470582434,Empirical analysis of the relationship between loan duration in months and its contribution to elevated credit risk and default probability.,"Based on the provided context, loan duration in months (labeled as ""Duration"") demonstrates a clear positive relationship with credit risk and default probability. The empirical analysis confirms that longer repayment periods are associated with an increased likelihood of default, which aligns with established theoretical expectations in credit modeling. This positive directional impact indicates that as the loan term extends, borrowers face prolonged exposure to financial instability, interest rate fluctuations, and income volatility, thereby elevating their default risk. Within the regression framework, Duration is explicitly identified as a key risk indicator, confirming its statistical relevance and predictive utility in the baseline OLS model. Although the excerpt does not report exact beta coefficients or p-values, it unequivocally establishes that the variable carries a positive coefficient and serves as a statistically meaningful benchmark for risk assessment. Consequently, loan duration functions as a critical, independently significant predictor for forecasting elevated credit risk in this analytical model.

**Evidence Bullets:**
- Duration (coeff: positive) is positively associated with elevated credit risk and default probability (Source: regression-based credit risk modeling.pdf, p. 23).
- Duration is explicitly categorized as a key risk indicator within the regression-based predictive framework (Source: regression-based credit risk modeling.pdf, p. 23).
- The positive directional effect of Duration aligns with theoretical expectations and validates its statistical significance as a descriptive benchmark (Source: regression-based credit risk modeling.pdf, p. 23).","[{""source"": ""regression-based credit risk modeling.pdf"", ""page"": 23, ""score"": 0.16526806354522705}, {""source"": ""regression-based credit risk modeling.pdf"", ""page"": 23, ""score"": 0.16542381048202515}]","[{""source"": ""regression-based credit risk modeling.pdf"", ""page"": 23, ""score"": 0.16526806354522705, ""sentence"": ""OLS also lays a solid foundation for Tikhonov regularization and logistic regression analysis.""}, {""source"": ""regression-based credit risk modeling.pdf"", ""page"": 23, ""score"": 0.16542381048202515, ""sentence"": ""OLS also lays a solid foundation for Tikhonov regularization and logistic regression analysis.""}]","{""min_docs"": 3, ""max_docs"": 20, ""min_gap"": 0.001, ""max_chunks_per_source"": 2, ""inspect_all"": false}"
