sample_idx,shap_json_path,prediction_label,prediction_probability,feature_rank,feature,feature_definition,feature_direction,feature_shap_value,feature_abs_shap,question,answer,selected_sources,evidence_sentences,retrieval_params
89,SHAP/Test Dataset Local Shap Correct/shap_tuples_non_prefix_89.json,UNKNOWN,UNKNOWN,1,duration,Loan duration in months.,decrease_risk,-0.09333733333653867,0.09333733333653867,Empirical analysis of the mitigating effect of loan duration in months on credit default probability.,"Based on the provided context, loan duration does not exert a mitigating effect on credit default probability; instead, it demonstrates a clear positive relationship with credit risk. The empirical analysis explicitly indicates that longer loan durations increase the likelihood of credit risk, directly contradicting the premise of a risk-reducing impact. This positive directional effect aligns with established theoretical expectations in credit scoring, where extended repayment periods typically elevate default probability due to prolonged exposure to borrower financial instability or shifting economic conditions. The text identifies duration as a statistically significant key risk indicator within regression-based models, confirming its predictive importance alongside other financial variables like credit amount and installment rate. Although the provided excerpts do not report exact regression coefficients or p-values for duration, the directional impact is unambiguously stated as positive. Consequently, empirical evidence from the source material confirms that increasing loan duration in months amplifies, rather than mitigates, credit default probability.

**Evidence Bullets:**
- Duration exhibits a positive directional impact, where longer durations increase the likelihood of credit risk (Source: regression-based credit risk modeling.pdf, page 23).
- Duration is confirmed as a statistically significant key risk indicator in regression-based credit risk models, with its effect corresponding to theoretical expectations (Source: regression-based credit risk modeling.pdf, page 23).
- Financial variables, including loan duration, are empirically highlighted as more important predictors of credit risk than demographic characteristics (Source: regression-based credit risk modeling.pdf, page 7).","[{""source"": ""regression-based credit risk modeling.pdf"", ""page"": 23, ""score"": 0.1750470995903015}, {""source"": ""regression-based credit risk modeling.pdf"", ""page"": 7, ""score"": 0.19061541557312012}, {""source"": ""An_Investigation_of_Credit_Card_Default_Prediction_in_the_Imbalanced_Datasets.pdf"", ""page"": 2, ""score"": 0.1982438564300537}]","[{""source"": ""regression-based credit risk modeling.pdf"", ""page"": 23, ""score"": 0.1750470995903015, ""sentence"": ""OLS also lays a solid foundation for Tikhonov regularization and logistic regression analysis.""}, {""source"": ""regression-based credit risk modeling.pdf"", ""page"": 7, ""score"": 0.19061541557312012, ""sentence"": ""Empirical work has exam- ined how demographic characteristics, such as age and marital status, and loan terms, such as loan size and interest rate, affect the borrower’s ability to repay on time (Özdemir, 2008).""}, {""source"": ""An_Investigation_of_Credit_Card_Default_Prediction_in_the_Imbalanced_Datasets.pdf"", ""page"": 2, ""score"": 0.1982438564300537, ""sentence"": ""These ratios reveal their accessibility and regularization capabilities of predic- tion.""}]","{""min_docs"": 3, ""max_docs"": 20, ""min_gap"": 0.001, ""max_chunks_per_source"": 2, ""inspect_all"": false}"
89,SHAP/Test Dataset Local Shap Correct/shap_tuples_non_prefix_89.json,UNKNOWN,UNKNOWN,2,checking_status_no checking,Checking account status: no checking account.,increase_risk,0.048562293973927945,0.048562293973927945,Statistical impact of having no checking account status on increasing credit risk.,"Based on the provided context, having a ""no checking account"" status does not increase credit risk; instead, it is statistically associated with a lower estimated probability of default. In the regression-based credit risk modeling analysis, this category serves as a significant discriminator within the logistic model, demonstrating a clear negative relationship with credit risk compared to the reference group. While applicants with checking account balances below zero face a substantially higher risk, those without a checking account are explicitly classified as less likely to be bad credit risks. The text identifies checking account status as one of the most significant predictors alongside financial and loan characteristics, confirming its statistical importance in the model. Although the excerpt does not report a precise numerical coefficient or p-value for this specific category, the directional impact is unambiguous and directly contradicts the premise that it increases risk. Consequently, within this specific dataset, the absence of a checking account functions as a protective factor rather than a risk amplifier.

**Evidence Bullets:**
- No checking account status (direction: negative association) is inversely associated with credit risk, functioning as an important discriminator in the logistic regression model (Source: regression-based credit risk modeling.pdf, p. 29).
- Checking account status (significance: among the most significant predictors) shows that the ""no checking account"" category reduces estimated risk relative to the reference group, while negative balances substantially increase risk (Source: regression-based credit risk modeling.pdf, p. 29).
- Financial and credit-related variables, including checking account status, are confirmed as the most significant predictors in both linear and logistic models, though exact beta coefficients for the ""no checking account"" category are not numerically specified in the provided excerpt (Source: regression-based credit risk modeling.pdf, p. 29).","[{""source"": ""regression-based credit risk modeling.pdf"", ""page"": 29, ""score"": 0.20860129594802856}, {""source"": ""How much do we see? On the explainability of partial dependence plots for credit risk scoring.pdf"", ""page"": 10, ""score"": 0.23806345462799072}, {""source"": ""regression-based credit risk modeling.pdf"", ""page"": 29, ""score"": 0.25006818771362305}]","[{""source"": ""regression-based credit risk modeling.pdf"", ""page"": 29, ""score"": 0.20860129594802856, ""sentence"": ""while the category of no checking account is associated with a lower estimated risk in this dataset.""}, {""source"": ""How much do we see? On the explainability of partial dependence plots for credit risk scoring.pdf"", ""page"": 10, ""score"": 0.23806345462799072, ""sentence"": ""2D PDP for the variables status account and duration.""}, {""source"": ""regression-based credit risk modeling.pdf"", ""page"": 29, ""score"": 0.25006818771362305, ""sentence"": ""Applicants with a checking account balance below 0 DM (Deutsche Mark) exhibit a substantially higher estimated risk relative to the reference group, while the category of no checking account is associated with a lower estimated risk in this""}]","{""min_docs"": 3, ""max_docs"": 20, ""min_gap"": 0.001, ""max_chunks_per_source"": 2, ""inspect_all"": false}"
89,SHAP/Test Dataset Local Shap Correct/shap_tuples_non_prefix_89.json,UNKNOWN,UNKNOWN,3,checking_status_0<=X<200,Checking account status: balance between 0 and 200 DM.,increase_risk,0.03169594491019188,0.03169594491019188,Determinants of credit risk: The association between a checking account balance between 0 and 200 DM and heightened default probability.,"Based on the provided context, the specific regression results for a checking account balance between 0 and 200 DM are not explicitly reported. The logistic model instead designates applicants with balances greater than 200 DM as the reference category. Relative to this baseline, the checking account status variable functions as a statistically significant predictor of default probability. Applicants with a balance below 0 DM demonstrate a strong positive association with credit risk, indicating a substantially higher likelihood of being classified as a bad credit risk. In contrast, the absence of a checking account shows a negative association, corresponding to a reduced estimated probability of default. Since the 0–200 DM category is omitted from the reported results, its exact coefficient and directional impact cannot be isolated, though the overall variable confirms that checking account status is a critical discriminator in credit risk modeling.

- Checking account balance < 0 DM (odds ratio: ~2.86) is positively associated with heightened credit risk relative to the >200 DM baseline (Source: regression-based credit risk modeling.pdf, p. 26).
- No checking account (odds ratio: ~0.41) is negatively associated with credit risk, indicating a lower default probability compared to the baseline (Source: regression-based credit risk modeling.pdf, p. 26).
- Checking account status overall is identified as a highly significant predictor in the logistic regression model for classifying bad credit risks (Source: regression-based credit risk modeling.pdf, p. 29).","[{""source"": ""regression-based credit risk modeling.pdf"", ""page"": 26, ""score"": 0.17049944400787354}, {""source"": ""Interest and credit risk management in German banks.pdf"", ""page"": 24, ""score"": 0.18502962589263916}, {""source"": ""regression-based credit risk modeling.pdf"", ""page"": 29, ""score"": 0.19988226890563965}]","[{""source"": ""regression-based credit risk modeling.pdf"", ""page"": 26, ""score"": 0.17049944400787354, ""sentence"": ""The checking accountStatusvariable uses applicants with more than 200 DM (Deutsche Mark) as the reference category.""}, {""source"": ""Interest and credit risk management in German banks.pdf"", ""page"": 24, ""score"": 0.18502962589263916, ""sentence"": ""slightly in the two different specifications, from −0.026 to −0.023.""}, {""source"": ""regression-based credit risk modeling.pdf"", ""page"": 29, ""score"": 0.19988226890563965, ""sentence"": ""Applicants with a checking account balance below 0 DM (Deutsche Mark) exhibit a substantially higher estimated risk relative to the reference group, while the category of no checking account is associated with a lower estimated risk in this""}]","{""min_docs"": 3, ""max_docs"": 20, ""min_gap"": 0.001, ""max_chunks_per_source"": 2, ""inspect_all"": false}"
