sample_idx,shap_json_path,prediction_label,prediction_probability,feature_rank,feature,feature_definition,feature_direction,feature_shap_value,feature_abs_shap,question,answer,selected_sources,evidence_sentences,retrieval_params
192,SHAP/Test Dataset Local Shap 25/shap_tuples_non_prefix_192.json,UNKNOWN,UNKNOWN,1,checking_status_no checking,Checking account status: no checking account.,decrease_risk,-0.07059424535934737,0.07059424535934737,Empirical analysis of the risk mitigation effects associated with the absence of a primary checking account on credit default probability.,"**Explanation:**
The provided context does not contain empirical data, regression coefficients, or statistical analysis specifically addressing the absence of a primary checking account or its impact on credit default probability. Consequently, the direction and significance of this variable’s risk mitigation effects cannot be determined from the supplied text. However, the context does establish clear directional relationships for other financial capacity and historical indicators. Specifically, longer loan durations and higher credit amounts are positively associated with an increased likelihood of credit risk. Additionally, the installment rate, along with categorical variables like Status and Purpose, are highlighted as key risk indicators in the baseline model. Conversely, variables such as Savings, Job, Housing, and Personal status were excluded from the final reduced model due to limited explanatory power or multicollinearity concerns. Therefore, while the text confirms the utility of financial ratios and historical data for predicting default, it offers no direct empirical findings on checking account status.

**Evidence Bullets:**
- Duration and Credit amount exhibit a positive association with credit default probability (Source: regression-based credit risk modeling.pdf, p. 23).
- Installment rate, Status, and Purpose are identified as statistically relevant risk indicators in the baseline OLS model (Source: regression-based credit risk modeling.pdf, p. 23).
- Predictors including Savings, Job, Housing, and Personal status were removed from the reduced model due to limited statistical relevance or multicollinearity (Source: regression-based credit risk modeling.pdf, p. 23).
- The final reduced OLS model demonstrates limited explanatory power with an R² of 0.24 and an adjusted R² of 0.22 (Source: regression-based credit risk modeling.pdf, p. 23).","[{""source"": ""regression-based credit risk modeling.pdf"", ""page"": 23, ""score"": 0.20822185277938843}, {""source"": ""An_Investigation_of_Credit_Card_Default_Prediction_in_the_Imbalanced_Datasets.pdf"", ""page"": 2, ""score"": 0.21713274717330933}, {""source"": ""regression-based credit risk modeling.pdf"", ""page"": 23, ""score"": 0.22639036178588867}, {""source"": ""An_Investigation_of_Credit_Card_Default_Prediction_in_the_Imbalanced_Datasets.pdf"", ""page"": 2, ""score"": 0.2270374894142151}, {""source"": ""Explainable Automated Machine Learning for Credit Decisions.pdf"", ""page"": 6, ""score"": 0.23218631744384766}, {""source"": ""Comparison Between XGBoost and Random Forest in Credit Risk Assessment Using the German Credit Dataset.pdf"", ""page"": 2, ""score"": 0.23691046237945557}, {""source"": ""The Application of Tree-based model to Unbalanced German Credit Data Analysis.pdf"", ""page"": 2, ""score"": 0.23856121301651}]","[{""source"": ""regression-based credit risk modeling.pdf"", ""page"": 23, ""score"": 0.20822185277938843, ""sentence"": ""OLS also lays a solid foundation for Tikhonov regularization and logistic regression analysis.""}, {""source"": ""An_Investigation_of_Credit_Card_Default_Prediction_in_the_Imbalanced_Datasets.pdf"", ""page"": 2, ""score"": 0.21713274717330933, ""sentence"": ""default client from non-defaulted [8] because these parame- ters may enhance the performance of models.""}, {""source"": ""regression-based credit risk modeling.pdf"", ""page"": 23, ""score"": 0.22639036178588867, ""sentence"": ""PredictorsPresent residence,Number of credits,People liableandTelephoneas well as dummy-encoded categorical groupsPersonal status,Other installment plans,Housing,Prop- erty,JobandSavingswere removed.""}, {""source"": ""An_Investigation_of_Credit_Card_Default_Prediction_in_the_Imbalanced_Datasets.pdf"", ""page"": 2, ""score"": 0.2270374894142151, ""sentence"": ""The stan- dard model depends on the ﬁnancial ratios, income account, and data on the balance sheet [6], [7].""}, {""source"": ""Explainable Automated Machine Learning for Credit Decisions.pdf"", ""page"": 6, ""score"": 0.23218631744384766, ""sentence"": ""Both accuracy and explainability are essential in aligning credit risk decisions with the dynamic demands o f the digital economy.""}, {""source"": ""Comparison Between XGBoost and Random Forest in Credit Risk Assessment Using the German Credit Dataset.pdf"", ""page"": 2, ""score"": 0.23691046237945557, ""sentence"": ""SHAP analysis conﬁrmed the primacy of features like 'Duration' and 'Credit Amount' while also uncovering subtle distinctions in feature interaction between the models.""}, {""source"": ""The Application of Tree-based model to Unbalanced German Credit Data Analysis.pdf"", ""page"": 2, ""score"": 0.23856121301651, ""sentence"": ""However, there are two unique features in credit evaluation analysis.""}]","{""min_docs"": 3, ""max_docs"": 20, ""min_gap"": 0.001, ""max_chunks_per_source"": 2, ""inspect_all"": false}"
192,SHAP/Test Dataset Local Shap 25/shap_tuples_non_prefix_192.json,UNKNOWN,UNKNOWN,2,purpose_education,Loan purpose: education.,increase_risk,0.04702553749297084,0.04702553749297084,Determinants of default: empirical investigation into how education loan purposes contribute to elevated credit risk profiles.,"Based strictly on the provided context, there is no empirical data, regression analysis, or discussion regarding ""education loan purposes"" as a determinant of credit risk or default probability. The literature instead focuses on traditional financial metrics, specifically highlighting that standard financial ratios, income account data, and balance sheet information serve as the primary predictors for classifying default versus non-default clients. These financial parameters are noted for their ability to reveal a borrower's accessibility and regularization capabilities, directly influencing the threshold values used in lending decisions. Additionally, the context examines institutional factors, such as the use of interest rate derivatives, which are modeled in regression frameworks to assess their impact on bond portfolio impairments and interest rate risk exposure. Modern credit risk assessment in the provided texts relies heavily on machine learning ensemble methods (e.g., Random Forest, Gradient Boosting) and Explainable AI to improve predictive accuracy and model transparency. Consequently, no positive or negative coefficient, nor any statistical significance, can be attributed to education loan purposes from this source material.

**Evidence Bullets:**
- ""Education loan purposes"" (coeff: N/A) is entirely absent from the provided context and lacks any reported statistical relationship with credit risk (Source: All provided snippets, p. N/A).
- Financial ratios, income accounts, and balance sheet data (coeff: N/A) are utilized as standard predictors to classify credit default clients from non-defaulted ones (Source: An_Investigation_of_Credit_Card_Default_Prediction_in_the_Imbalanced_Datasets.pdf, p. 2).
- Usage of interest derivatives (coeff: β1,D in Eq. 3) is incorporated into regression models to evaluate its effect on bond portfolio impairments and interest rate risk (Source: Interest and credit risk management in German banks.pdf, p. 18).
- Ensemble machine learning algorithms (coeff: N/A) and logistic regression are identified as industry standards for assessing financial obligations and default probability (Source: Comparison Between XGBoost and Random Forest in Credit Risk Assessment Using the German Credit Dataset.pdf, p. 2).","[{""source"": ""An_Investigation_of_Credit_Card_Default_Prediction_in_the_Imbalanced_Datasets.pdf"", ""page"": 2, ""score"": 0.19294244050979614}, {""source"": ""An_Investigation_of_Credit_Card_Default_Prediction_in_the_Imbalanced_Datasets.pdf"", ""page"": 1, ""score"": 0.1982378363609314}, {""source"": ""Explainable Automated Machine Learning for Credit Decisions.pdf"", ""page"": 6, ""score"": 0.20484846830368042}, {""source"": ""Interest and credit risk management in German banks.pdf"", ""page"": 18, ""score"": 0.2148648500442505}, {""source"": ""Comparison Between XGBoost and Random Forest in Credit Risk Assessment Using the German Credit Dataset.pdf"", ""page"": 2, ""score"": 0.21786004304885864}]","[{""source"": ""An_Investigation_of_Credit_Card_Default_Prediction_in_the_Imbalanced_Datasets.pdf"", ""page"": 2, ""score"": 0.19294244050979614, ""sentence"": ""These ratios reveal their accessibility and regularization capabilities of predic- tion.""}, {""source"": ""An_Investigation_of_Credit_Card_Default_Prediction_in_the_Imbalanced_Datasets.pdf"", ""page"": 1, ""score"": 0.1982378363609314, ""sentence"": ""ﬁnancial organizations, loan institutes, and other decision-makers to predict the loan defaulter earlier.""}, {""source"": ""Explainable Automated Machine Learning for Credit Decisions.pdf"", ""page"": 6, ""score"": 0.20484846830368042, ""sentence"": ""Both accuracy and explainability are essential in aligning credit risk decisions with the dynamic demands o f the digital economy.""}, {""source"": ""Interest and credit risk management in German banks.pdf"", ""page"": 18, ""score"": 0.2148648500442505, ""sentence"": ""80 | V .""}, {""source"": ""Comparison Between XGBoost and Random Forest in Credit Risk Assessment Using the German Credit Dataset.pdf"", ""page"": 2, ""score"": 0.21786004304885864, ""sentence"": ""ﬁnancial obligations, represents a critical function for lending institutions.""}]","{""min_docs"": 3, ""max_docs"": 20, ""min_gap"": 0.001, ""max_chunks_per_source"": 2, ""inspect_all"": false}"
192,SHAP/Test Dataset Local Shap 25/shap_tuples_non_prefix_192.json,UNKNOWN,UNKNOWN,3,credit_history_critical/other existing credit,Credit history: critical account or other existing credits.,decrease_risk,-0.03733781959627032,0.03733781959627032,Credit risk drivers: empirical assessment of the risk reduction mechanisms linked to critical or diversified existing credit histories.,"Based on the provided context, credit risk is empirically driven by quantifiable financial capacity and credit history metrics rather than abstract diversification strategies. The regression analysis identifies Duration and Credit amount as significant positive predictors, indicating that longer loan terms and larger principal amounts directly increase the probability of default. Installment rate, along with specific categorical levels of Status and Purpose, are also established as key risk indicators within the reduced model framework. The study employs Ordinary Least Squares (OLS) regression as an interpretable baseline to quantify these directional relationships before applying Tikhonov regularization to mitigate multicollinearity and stabilize coefficient estimates. Notably, the provided text does not validate the premise that diversified or critical credit histories inherently reduce risk; instead, it demonstrates that specific historical and financial characteristics consistently elevate risk exposure. Consequently, effective risk assessment in this empirical framework relies on accurately measuring these direct risk drivers rather than relying on portfolio diversification mechanisms.

**Evidence Bullets:**
- Duration exhibits a positive directional impact on credit risk, as longer durations are empirically linked to a higher likelihood of default (Source: regression-based credit risk modeling.pdf, p. 23).
- Credit amount shows a positive association with risk, where higher requested amounts directly increase credit risk exposure (Source: regression-based credit risk modeling.pdf, p. 23).
- Installment rate, Status, and Purpose are confirmed as key risk indicators within the reduced OLS model, though exact coefficient values are not reported in the excerpt (Source: regression-based credit risk modeling.pdf, p. 23).
- The reduced model serves as an effective descriptive benchmark, confirming that these financial and historical variables reliably predict credit risk classifications (Source: regression-based credit risk modeling.pdf, p. 23).","[{""source"": ""regression-based credit risk modeling.pdf"", ""page"": 23, ""score"": 0.21774864196777344}, {""source"": ""regression-based credit risk modeling.pdf"", ""page"": 22, ""score"": 0.2213178277015686}, {""source"": ""Research on Credit Risk Assessment Optimization based on Machine Learning.pdf"", ""page"": 2, ""score"": 0.22825348377227783}, {""source"": ""Research on Credit Risk Assessment Optimization based on Machine Learning.pdf"", ""page"": 2, ""score"": 0.23108744621276855}]","[{""source"": ""regression-based credit risk modeling.pdf"", ""page"": 23, ""score"": 0.21774864196777344, ""sentence"": ""financial capacity and credit history, such asDuration,Credit amount,Installment rate, and various levels ofStatusandPurposeas key risk indicators.""}, {""source"": ""regression-based credit risk modeling.pdf"", ""page"": 22, ""score"": 0.2213178277015686, ""sentence"": ""17 4 Experimental Results In this chapter, the empirical findings are presented and interpreted.""}, {""source"": ""Research on Credit Risk Assessment Optimization based on Machine Learning.pdf"", ""page"": 2, ""score"": 0.22825348377227783, ""sentence"": ""In the credit business, the problem of credit risk assessment with the customer as the Disclaimer/Publisher’s Note: The statements, opinions, and data contained in all publications are solely those of the individual author(s) and contributor(s) and not of MDPI and/or the editor(s).""}, {""source"": ""Research on Credit Risk Assessment Optimization based on Machine Learning.pdf"", ""page"": 2, ""score"": 0.23108744621276855, ""sentence"": ""Credit risk assessment is the most basic and critical part of credit loan management.""}]","{""min_docs"": 3, ""max_docs"": 20, ""min_gap"": 0.001, ""max_chunks_per_source"": 2, ""inspect_all"": false}"
