sample_idx,shap_json_path,prediction_label,prediction_probability,feature_rank,feature,feature_definition,feature_direction,feature_shap_value,feature_abs_shap,question,answer,selected_sources,evidence_sentences,retrieval_params
22,SHAP/Test Dataset Local Shap Correct/shap_tuples_non_prefix_22.json,UNKNOWN,UNKNOWN,1,checking_status_no checking,Checking account status: no checking account.,increase_risk,0.04958889708671706,0.04958889708671706,Empirical analysis of the relationship between the absence of a checking account and increased credit default probability.,"Based on the provided context, the empirical analysis indicates that the absence of a checking account does not increase credit default probability; rather, it is associated with a lower estimated credit risk. This finding directly contradicts the premise that lacking a checking account elevates default likelihood. The dataset explicitly categorizes applicants without a checking account and determines that this group presents a reduced risk profile compared to other categories. Although the excerpt does not report a specific regression coefficient or p-value for this variable, it clearly establishes a negative directional relationship with credit risk. This suggests that, within this particular sample, financial institutions may interpret the absence of a checking account as a neutral or favorable indicator, possibly due to correlated demographic or behavioral factors not detailed in the text. Consequently, the variable functions as a risk-mitigating factor rather than a risk-amplifying one in this specific modeling framework.

Evidence Bullets:
- No checking account category (direction: negative) is explicitly linked to a lower estimated credit risk, demonstrating a reduced rather than increased default probability (Source: regression-based credit risk modeling.pdf, p. 29).
- The model output confirms that this specific category contradicts conventional risk assumptions, as it correlates with decreased risk estimation in the evaluated dataset (Source: regression-based credit risk modeling.pdf, p. 29).
- While exact coefficients are not provided in the excerpt, the analysis emphasizes that this financial category stands out as an exception to typical risk drivers, functioning as a noted risk-reducing indicator in both logistic and linear specifications (Source: regression-based credit risk modeling.pdf, p. 29).","[{""source"": ""regression-based credit risk modeling.pdf"", ""page"": 29, ""score"": 0.19412684440612793}, {""source"": ""An_Investigation_of_Credit_Card_Default_Prediction_in_the_Imbalanced_Datasets.pdf"", ""page"": 23, ""score"": 0.21461492776870728}, {""source"": ""regression-based credit risk modeling.pdf"", ""page"": 23, ""score"": 0.2154775857925415}]","[{""source"": ""regression-based credit risk modeling.pdf"", ""page"": 29, ""score"": 0.19412684440612793, ""sentence"": ""while the category of no checking account is associated with a lower estimated risk in this dataset.""}, {""source"": ""An_Investigation_of_Credit_Card_Default_Prediction_in_the_Imbalanced_Datasets.pdf"", ""page"": 23, ""score"": 0.21461492776870728, ""sentence"": ""This low-productivity, signiﬁcant expense conjectures cannot meet consumer ﬁnance enterprise’s credit""}, {""source"": ""regression-based credit risk modeling.pdf"", ""page"": 23, ""score"": 0.2154775857925415, ""sentence"": ""OLS also lays a solid foundation for Tikhonov regularization and logistic regression analysis.""}]","{""min_docs"": 3, ""max_docs"": 20, ""min_gap"": 0.001, ""max_chunks_per_source"": 2, ""inspect_all"": false}"
22,SHAP/Test Dataset Local Shap Correct/shap_tuples_non_prefix_22.json,UNKNOWN,UNKNOWN,2,savings_status_<100,Savings account status: savings below 100 DM.,increase_risk,0.04039632092869061,0.04039632092869061,Investigation of savings account balances below 100 DM as a determinant of elevated credit risk.,"Based on the provided context, savings account balances function as a meaningful predictor of credit risk, with lower savings categories generally indicating an elevated probability of default. The regression analysis reveals a positive directional relationship between minimal savings levels and higher estimated credit risk, meaning that applicants with balances in the lower tiers (such as below 100 DM) are more likely to be classified as bad credit risks compared to those with higher savings. This finding aligns with the broader model results showing that financial variables, including savings categories, carry meaningful weight in credit risk classification. However, the context explicitly notes that while the overall trend points toward increased risk for lower savings, not every specific savings threshold achieves statistical significance across all model specifications. Consequently, low savings balances act as a risk amplifier, though their predictive strength is generally milder than that of primary financial predictors like loan duration or credit amount.

**Evidence Bullets:**
- Lower savings categories are positively associated with higher estimated credit risk compared to the reference category, though not all specific savings levels demonstrate statistical significance (Source: regression-based credit risk modeling.pdf, page 29).
- Savings categories show meaningful associations with credit risk classification, functioning as informative predictors alongside checking account status (Source: regression-based credit risk modeling.pdf, page 2).
- Financial and credit-related variables, including savings, are identified as stronger predictors of credit risk than demographic characteristics, which only exhibit a modest negative association (Source: regression-based credit risk modeling.pdf, page 29).","[{""source"": ""Interest and credit risk management in German banks.pdf"", ""page"": 24, ""score"": 0.20574015378952026}, {""source"": ""Interest and credit risk management in German banks.pdf"", ""page"": 24, ""score"": 0.22193294763565063}, {""source"": ""German Credit Risk Prediction Using Machine Learning Models.pdf"", ""page"": 6, ""score"": 0.2307295799255371}, {""source"": ""The Application of Tree-based model to Unbalanced German Credit Data Analysis.pdf"", ""page"": 2, ""score"": 0.23359394073486328}, {""source"": ""regression-based credit risk modeling.pdf"", ""page"": 2, ""score"": 0.23382306098937988}, {""source"": ""regression-based credit risk modeling.pdf"", ""page"": 29, ""score"": 0.23469483852386475}]","[{""source"": ""Interest and credit risk management in German banks.pdf"", ""page"": 24, ""score"": 0.20574015378952026, ""sentence"": ""slightly in the two different specifications, from −0.026 to −0.023.""}, {""source"": ""Interest and credit risk management in German banks.pdf"", ""page"": 24, ""score"": 0.22193294763565063, ""sentence"": ""This suggests""}, {""source"": ""German Credit Risk Prediction Using Machine Learning Models.pdf"", ""page"": 6, ""score"": 0.2307295799255371, ""sentence"": ""As shown in Fig .""}, {""source"": ""The Application of Tree-based model to Unbalanced German Credit Data Analysis.pdf"", ""page"": 2, ""score"": 0.23359394073486328, ""sentence"": ""and low-risk groups with the information like gender, age and savings account.""}, {""source"": ""regression-based credit risk modeling.pdf"", ""page"": 2, ""score"": 0.23382306098937988, ""sentence"": ""Checking account status and savings categories also show meaningful associ- ations with credit risk classification.""}, {""source"": ""regression-based credit risk modeling.pdf"", ""page"": 29, ""score"": 0.23469483852386475, ""sentence"": ""Savings are also informative.""}]","{""min_docs"": 3, ""max_docs"": 20, ""min_gap"": 0.001, ""max_chunks_per_source"": 2, ""inspect_all"": false}"
22,SHAP/Test Dataset Local Shap Correct/shap_tuples_non_prefix_22.json,UNKNOWN,UNKNOWN,3,checking_status_<0,Checking account status: balance below 0 DM.,decrease_risk,-0.0345436516257621,0.0345436516257621,Statistical evidence regarding the association between negative checking account balances and decreased credit risk exposure.,"Based on the provided context, the statistical evidence directly contradicts the premise that negative checking account balances are associated with decreased credit risk. Instead, applicants with checking account balances below zero exhibit a substantially higher estimated risk of default compared to the reference group. The checking account status variable emerges as a statistically significant discriminator in logistic regression models, where negative balances strongly predict adverse credit outcomes. Conversely, the complete absence of a checking account is associated with a lower estimated risk in this specific dataset. While exact regression coefficients for these balance categories are not explicitly quantified in the text, the directional relationship is clearly positive, meaning negative balances increase rather than decrease credit risk exposure. This finding aligns with standard credit modeling intuition, where negative liquidity positions serve as a primary indicator of financial distress and higher default probability.

**Evidence Bullets:**
- Negative checking account balance (qualitative: substantially higher risk) is positively associated with bad credit risk classification (Source: regression-based credit risk modeling.pdf, p. 29).
- Checking account status (qualitative: important discriminator) demonstrates statistical significance in logistic models for predicting default probability (Source: regression-based credit risk modeling.pdf, p. 29).
- No checking account category (qualitative: lower estimated risk) shows a negative association with credit risk in this dataset (Source: regression-based credit risk modeling.pdf, p. 29).","[{""source"": ""regression-based credit risk modeling.pdf"", ""page"": 29, ""score"": 0.21683508157730103}, {""source"": ""Interest and credit risk management in German banks.pdf"", ""page"": 24, ""score"": 0.22537118196487427}, {""source"": ""regression-based credit risk modeling.pdf"", ""page"": 29, ""score"": 0.23261886835098267}]","[{""source"": ""regression-based credit risk modeling.pdf"", ""page"": 29, ""score"": 0.21683508157730103, ""sentence"": ""while the category of no checking account is associated with a lower estimated risk in this dataset.""}, {""source"": ""Interest and credit risk management in German banks.pdf"", ""page"": 24, ""score"": 0.22537118196487427, ""sentence"": ""there is only a weak link between a bank’s exposure to interest rate risk and the change in its net interest income given an interest rate shock, which may be due to relatively low interest rate risk exposure of the banks in the sample.""}, {""source"": ""regression-based credit risk modeling.pdf"", ""page"": 29, ""score"": 0.23261886835098267, ""sentence"": ""Applicants with a checking account balance below 0 DM (Deutsche Mark) exhibit a substantially higher estimated risk relative to the reference group, while the category of no checking account is associated with a lower estimated risk in this""}]","{""min_docs"": 3, ""max_docs"": 20, ""min_gap"": 0.001, ""max_chunks_per_source"": 2, ""inspect_all"": false}"
