sample_idx,shap_json_path,prediction_label,prediction_probability,feature_rank,feature,feature_definition,feature_direction,feature_shap_value,feature_abs_shap,question,answer,selected_sources,evidence_sentences,retrieval_params
100,SHAP/Test Dataset Local Shap Correct/shap_tuples_non_prefix_100.json,UNKNOWN,UNKNOWN,1,checking_status_no checking,Checking account status: no checking account.,increase_risk,0.06556830989586315,0.06556830989586315,Analyze the statistical impact of having no checking account on increased credit default probability.,"Based on the provided context, the variable ""no checking account"" exhibits a negative association with credit risk, meaning it is linked to a lower estimated probability of default rather than an increased one. Contrary to the premise that lacking a checking account elevates default risk, the dataset explicitly indicates that applicants in this category are associated with reduced credit risk. This suggests that within the specific population and modeling framework analyzed, the absence of a checking account does not function as a risk amplifier and may instead reflect other compensating financial behaviors or demographic traits. The excerpt does not report a precise regression coefficient or p-value for this specific category, but it clearly establishes the directional impact as risk-mitigating. Consequently, in this particular modeling environment, the ""no checking account"" status operates as a favorable or neutral predictor rather than a warning sign for potential default.

**Evidence Bullets:**
- The ""no checking account"" category is explicitly associated with a lower estimated risk, indicating a negative relationship with credit default probability (Source: regression-based credit risk modeling.pdf, p. 29).
- While the provided text does not list a specific beta coefficient or p-value for this variable, it confirms the directional impact is statistically noted as reducing estimated risk within the analyzed dataset (Source: regression-based credit risk modeling.pdf, p. 29).
- Financial and credit-related variables generally outperform demographic predictors in this model, yet the checking account status still provides distinct, inverse risk information that contradicts conventional assumptions about account ownership (Source: regression-based credit risk modeling.pdf, p. 29).","[{""source"": ""regression-based credit risk modeling.pdf"", ""page"": 29, ""score"": 0.19685685634613037}, {""source"": ""An_Investigation_of_Credit_Card_Default_Prediction_in_the_Imbalanced_Datasets.pdf"", ""page"": 23, ""score"": 0.21680617332458496}, {""source"": ""An_Investigation_of_Credit_Card_Default_Prediction_in_the_Imbalanced_Datasets.pdf"", ""page"": 2, ""score"": 0.21914434432983398}]","[{""source"": ""regression-based credit risk modeling.pdf"", ""page"": 29, ""score"": 0.19685685634613037, ""sentence"": ""while the category of no checking account is associated with a lower estimated risk in this dataset.""}, {""source"": ""An_Investigation_of_Credit_Card_Default_Prediction_in_the_Imbalanced_Datasets.pdf"", ""page"": 23, ""score"": 0.21680617332458496, ""sentence"": ""This low-productivity, signiﬁcant expense conjectures cannot meet consumer ﬁnance enterprise’s credit""}, {""source"": ""An_Investigation_of_Credit_Card_Default_Prediction_in_the_Imbalanced_Datasets.pdf"", ""page"": 2, ""score"": 0.21914434432983398, ""sentence"": ""default client from non-defaulted [8] because these parame- ters may enhance the performance of models.""}]","{""min_docs"": 3, ""max_docs"": 20, ""min_gap"": 0.001, ""max_chunks_per_source"": 2, ""inspect_all"": false}"
100,SHAP/Test Dataset Local Shap Correct/shap_tuples_non_prefix_100.json,UNKNOWN,UNKNOWN,2,employment_4<=X<7,Present employment duration: between 4 and 7 years.,decrease_risk,-0.044208525535684516,0.044208525535684516,Examine the determinants of credit risk mitigation associated with present employment duration between four and seven years.,"Based strictly on the provided context, there is no statistical evidence, regression output, or discussion regarding ""present employment duration between four and seven years"" as a determinant of credit risk or credit risk mitigation. The excerpts exclusively analyze other financial and demographic predictors, such as loan duration, credit amount, installment rates, checking account status, savings categories, age, and foreign worker status. While the text establishes that longer loan durations and larger credit amounts positively correlate with a higher probability of default, and age exhibits a statistically significant negative association with bad credit risk, employment tenure is completely absent from the reported models. Consequently, it is impossible to determine the direction of impact or statistical significance for the requested employment duration category using only the supplied material. To evaluate how a 4–7 year employment history influences default probability, additional model specifications or dataset documentation explicitly detailing employment variables would be necessary.

**Evidence Bullets:**
- The provided excerpts do not contain any regression coefficients, p-values, or risk classifications for ""present employment duration between four and seven years"" (Source: regression-based credit risk modeling.pdf, pages 2 & 7).
- Longer loan durations, larger credit amounts, and higher installment rates are positively associated with a higher likelihood of being classified as a bad credit risk (Source: regression-based credit risk modeling.pdf, page 2).
- Age shows a statistically significant negative association with credit risk in the reduced logistic model, indicating older applicants face lower estimated default probabilities (Source: regression-based credit risk modeling.pdf, page 2).
- Foreign worker applicants demonstrate a strong positive association with higher estimated credit risk, while checking account status and savings categories also serve as meaningful predictors (Source: regression-based credit risk modeling.pdf, page 2).
- The second source focuses on institutional interest rate risk exposure and bank resilience metrics rather than borrower-level employment duration or credit risk mitigation factors (Source: Interest and credit risk management in German banks.pdf, pages 5 & 14).","[{""source"": ""regression-based credit risk modeling.pdf"", ""page"": 2, ""score"": 0.22528588771820068}, {""source"": ""regression-based credit risk modeling.pdf"", ""page"": 7, ""score"": 0.2376386523246765}, {""source"": ""Interest and credit risk management in German banks.pdf"", ""page"": 14, ""score"": 0.23988646268844604}, {""source"": ""Interest and credit risk management in German banks.pdf"", ""page"": 5, ""score"": 0.2407943606376648}]","[{""source"": ""regression-based credit risk modeling.pdf"", ""page"": 2, ""score"": 0.22528588771820068, ""sentence"": ""cants are the strongest predictors of credit risk.""}, {""source"": ""regression-based credit risk modeling.pdf"", ""page"": 7, ""score"": 0.2376386523246765, ""sentence"": ""separates “good” and “bad” borrowers as effectively as possible.""}, {""source"": ""Interest and credit risk management in German banks.pdf"", ""page"": 14, ""score"": 0.23988646268844604, ""sentence"": ""there are banks that have lower net interest margins (relative to the baseline sce- nario) even after five years (62 banks).""}, {""source"": ""Interest and credit risk management in German banks.pdf"", ""page"": 5, ""score"": 0.2407943606376648, ""sentence"": ""The first part of the survey, i. e. the low-interest rate environ- ment survey in the narrow sense, has a horizon of five years (from 2017 to 2021) and banks had to quantify many positions of their financial statements for the""}]","{""min_docs"": 3, ""max_docs"": 20, ""min_gap"": 0.001, ""max_chunks_per_source"": 2, ""inspect_all"": false}"
100,SHAP/Test Dataset Local Shap Correct/shap_tuples_non_prefix_100.json,UNKNOWN,UNKNOWN,3,checking_status_<0,Checking account status: balance below 0 DM.,decrease_risk,-0.033594527346665945,0.033594527346665945,Assess the statistical impact of checking account balances below zero on the reduction of credit risk exposure.,"Based on the provided context, checking account balances below zero do not reduce credit risk exposure; instead, they are statistically associated with an increased probability of default. The analysis indicates that while applicants with no checking account at all tend to exhibit a lower estimated risk, existing accounts that fall into low or negative balance categories actually trigger a stronger increase in credit risk. This directional relationship suggests that negative balances function as a negative predictor of creditworthiness, amplifying rather than mitigating default probability. Consequently, risk models treat these negative balances as a signal of financial distress, directly contradicting the premise that they would lower risk exposure. The statistical evidence consistently points to a positive correlation between negative checking account balances and higher credit risk, meaning these balances exacerbate rather than reduce a lender's exposure.

**Evidence Bullets:**
- Existing accounts with a low or negative balance demonstrate a stronger increase in credit risk, indicating a positive directional impact on default probability (Source: How much do we see? On the explainability of partial dependence plots for credit risk scoring.pdf, p. 10).
- The category of ""no checking account"" is associated with a lower estimated risk in both logistic and linear models, highlighting that account absence is less risky than maintaining a negative balance (Source: regression-based credit risk modeling.pdf, p. 29).
- While exact regression coefficients for negative balances are not tabulated in the provided excerpts, the partial dependence analysis explicitly notes that the risk increase is statistically stronger for these account statuses compared to positive or neutral balances.","[{""source"": ""regression-based credit risk modeling.pdf"", ""page"": 23, ""score"": 0.21165424585342407}, {""source"": ""regression-based credit risk modeling.pdf"", ""page"": 29, ""score"": 0.21366888284683228}, {""source"": ""How much do we see? On the explainability of partial dependence plots for credit risk scoring.pdf"", ""page"": 10, ""score"": 0.21626245975494385}, {""source"": ""Interest and credit risk management in German banks.pdf"", ""page"": 8, ""score"": 0.21976619958877563}, {""source"": ""Interest and credit risk management in German banks.pdf"", ""page"": 25, ""score"": 0.2281169891357422}, {""source"": ""The Application of Tree-based model to Unbalanced German Credit Data Analysis.pdf"", ""page"": 2, ""score"": 0.23248445987701416}, {""source"": ""Comparison Between XGBoost and Random Forest in Credit Risk Assessment Using the German Credit Dataset.pdf"", ""page"": 4, ""score"": 0.23392844200134277}]","[{""source"": ""regression-based credit risk modeling.pdf"", ""page"": 23, ""score"": 0.21165424585342407, ""sentence"": ""PredictorsPresent residence,Number of credits,People liableandTelephoneas well as dummy-encoded categorical groupsPersonal status,Other installment plans,Housing,Prop- erty,JobandSavingswere removed.""}, {""source"": ""regression-based credit risk modeling.pdf"", ""page"": 29, ""score"": 0.21366888284683228, ""sentence"": ""while the category of no checking account is associated with a lower estimated risk in this dataset.""}, {""source"": ""How much do we see? On the explainability of partial dependence plots for credit risk scoring.pdf"", ""page"": 10, ""score"": 0.21626245975494385, ""sentence"": ""for all status levels of the account, but an observable interaction exists for existing accounts with a low or negative balance where the increase in risk is stronger.""}, {""source"": ""Interest and credit risk management in German banks.pdf"", ""page"": 8, ""score"": 0.21976619958877563, ""sentence"": ""There are good reasons to measure a bank’s exposure to interest rate risk with re- spect to the impact on its earnings, especially as our sample is composed of small and medium banks for which the two arguments from above are relevant.""}, {""source"": ""Interest and credit risk management in German banks.pdf"", ""page"": 25, ""score"": 0.2281169891357422, ""sentence"": ""We do so because these variables are found in the literature to impact the net interest margin (see, for instance, Saunders and Schu- macher (2000) and Busch and Memmel (2016)).""}, {""source"": ""The Application of Tree-based model to Unbalanced German Credit Data Analysis.pdf"", ""page"": 2, ""score"": 0.23248445987701416, ""sentence"": ""and low-risk groups with the information like gender, age and savings account.""}, {""source"": ""Comparison Between XGBoost and Random Forest in Credit Risk Assessment Using the German Credit Dataset.pdf"", ""page"": 4, ""score"": 0.23392844200134277, ""sentence"": ""7.""}]","{""min_docs"": 3, ""max_docs"": 20, ""min_gap"": 0.001, ""max_chunks_per_source"": 2, ""inspect_all"": false}"
