sample_idx,shap_json_path,prediction_label,prediction_probability,feature_rank,feature,feature_definition,feature_direction,feature_shap_value,feature_abs_shap,question,answer,selected_sources,evidence_sentences,retrieval_params
207,SHAP/Test Dataset Local Shap 25/shap_tuples_non_prefix_207.json,UNKNOWN,UNKNOWN,1,checking_status_no checking,Checking account status: no checking account.,increase_risk,0.04859220701999847,0.04859220701999847,Statistical impact of having no checking account on credit default probability and its contribution to elevated credit risk drivers.,"Based on the provided regression-based credit risk modeling context, the variable ""no checking account"" demonstrates a negative association with credit risk, meaning it is linked to a lower estimated probability of default in the analyzed dataset. This finding directly contradicts the premise that lacking a checking account contributes to elevated credit risk drivers; instead, it functions as a risk-reducing factor within this specific model. The text explicitly notes that this category is associated with reduced estimated risk, although it does not report a specific regression coefficient or p-value for this particular variable. While other predictors like age and savings levels show statistically significant or directionally consistent relationships with default probability, the ""no checking account"" indicator stands out as a protective variable in this dataset. Consequently, applicants without a checking account are less likely to be classified as bad credit risks compared to those who maintain one. This suggests that, within the studied population, the absence of a checking account may serve as a proxy for alternative financial stability or conservative credit management practices rather than a liability.

- ""no checking account"" category is associated with a lower estimated risk (negative direction) in the dataset (Source: regression-based credit risk modeling.pdf, p. 29).
- The provided text does not report a specific regression coefficient or p-value for this variable, but explicitly confirms its risk-reducing direction (Source: regression-based credit risk modeling.pdf, p. 29).
- Lower savings categories are associated with higher estimated risk, though not all savings levels show statistically significant differences (Source: regression-based credit risk modeling.pdf, p. 29).
- Age shows a statistically significant, modest negative association with credit risk, indicating older applicants face lower default probability (Source: regression-based credit risk modeling.pdf, p. 29).","[{""source"": ""regression-based credit risk modeling.pdf"", ""page"": 29, ""score"": 0.21157872676849365}, {""source"": ""An_Investigation_of_Credit_Card_Default_Prediction_in_the_Imbalanced_Datasets.pdf"", ""page"": 2, ""score"": 0.225125253200531}, {""source"": ""An_Investigation_of_Credit_Card_Default_Prediction_in_the_Imbalanced_Datasets.pdf"", ""page"": 23, ""score"": 0.23667138814926147}]","[{""source"": ""regression-based credit risk modeling.pdf"", ""page"": 29, ""score"": 0.21157872676849365, ""sentence"": ""while the category of no checking account is associated with a lower estimated risk in this dataset.""}, {""source"": ""An_Investigation_of_Credit_Card_Default_Prediction_in_the_Imbalanced_Datasets.pdf"", ""page"": 2, ""score"": 0.225125253200531, ""sentence"": ""default client from non-defaulted [8] because these parame- ters may enhance the performance of models.""}, {""source"": ""An_Investigation_of_Credit_Card_Default_Prediction_in_the_Imbalanced_Datasets.pdf"", ""page"": 23, ""score"": 0.23667138814926147, ""sentence"": ""This low-productivity, signiﬁcant expense conjectures cannot meet consumer ﬁnance enterprise’s credit""}]","{""min_docs"": 3, ""max_docs"": 20, ""min_gap"": 0.001, ""max_chunks_per_source"": 2, ""inspect_all"": false}"
207,SHAP/Test Dataset Local Shap 25/shap_tuples_non_prefix_207.json,UNKNOWN,UNKNOWN,2,checking_status_0<=X<200,Checking account status: balance between 0 and 200 DM.,increase_risk,0.027588084516510514,0.027588084516510514,Empirical analysis of checking account balances between 0 and 200 DM as a determinant of default and a credit risk driver increasing loan default likelihood.,"Based on the provided context, the checking account status is a highly significant predictor of credit risk, though the specific 0–200 DM balance range is not explicitly isolated in the excerpts. Instead, the regression model uses applicants with balances exceeding 200 DM as the reference (baseline) category. Relative to this baseline, applicants with negative checking account balances (below 0 DM) exhibit a significantly higher likelihood of default, with an odds ratio of approximately 2.86, indicating a strong positive association with bad credit risk. Conversely, applicants with no checking account at all demonstrate a substantially lower estimated risk, with an odds ratio of roughly 0.41, reflecting a negative association with default probability. Feature selection analysis further confirms that checking account status is the most critical determinant among all evaluated variables, ranking first with a gain ratio of 0.052573. Consequently, while the exact 0–200 DM bracket is not separately quantified, the empirical evidence clearly establishes that checking account balance levels are a primary driver of credit risk, with negative balances sharply increasing default likelihood and the absence of an account decreasing it.

**Evidence Bullets:**
- Checking account balance < 0 DM shows a significantly higher log-odds of bad credit risk with an odds ratio of ~2.86 (Source: regression-based credit risk modeling.pdf, p. 26).
- No checking account category exhibits a lower estimated log-odds of default, with an odds ratio of ~0.41 relative to the >200 DM baseline (Source: regression-based credit risk modeling.pdf, p. 26).
- Checking account status ranks as the top feature predictor with a gain ratio of 0.052573, confirming its high statistical significance in credit risk assessment (Source: Analysis_of_feature_selection_techniques_in_credit_risk_assessment.pdf, p. 4).
- Logistic and linear models identify checking account status as a key discriminator, where negative balances substantially increase estimated risk while no account decreases it (Source: regression-based credit risk modeling.pdf, p. 29).","[{""source"": ""regression-based credit risk modeling.pdf"", ""page"": 26, ""score"": 0.1805877685546875}, {""source"": ""Analysis_of_feature_selection_techniques_in_credit_risk_assessment.pdf"", ""page"": 4, ""score"": 0.19391894340515137}, {""source"": ""regression-based credit risk modeling.pdf"", ""page"": 29, ""score"": 0.20953810214996338}]","[{""source"": ""regression-based credit risk modeling.pdf"", ""page"": 26, ""score"": 0.1805877685546875, ""sentence"": ""The checking accountStatusvariable uses applicants with more than 200 DM (Deutsche Mark) as the reference category.""}, {""source"": ""Analysis_of_feature_selection_techniques_in_credit_risk_assessment.pdf"", ""page"": 4, ""score"": 0.19391894340515137, ""sentence"": ""Value of gain ratio 1 Status of checking account 0.052573 20 Foreign worker 0.025499 3 Credit history 0.02548 2 Duration in month 0.025458 5 Credit amount 0.022629 6 Savings account 0.016658 13 Age in years 0.016078 15 Housing 0.011197 14 Other installment plans 0.010507 4 Purpose 0.009335 10 Others debtors 0.008909 12 Property 0.00872 7 Present employment since 0.006079 9 Personal status and sex 0.004445 19 Telephone 0.00099 17 Job 0.000946 16 Number of existing credits at bank 0 8 Installment rate in percentage 0 11 Present residence since 0 18 Number of people being liable to provide maintenance 0 The chi-square statistics is a correlation method used to""}, {""source"": ""regression-based credit risk modeling.pdf"", ""page"": 29, ""score"": 0.20953810214996338, ""sentence"": ""Applicants with a checking account balance below 0 DM (Deutsche Mark) exhibit a substantially higher estimated risk relative to the reference group, while the category of no checking account is associated with a lower estimated risk in this""}]","{""min_docs"": 3, ""max_docs"": 20, ""min_gap"": 0.001, ""max_chunks_per_source"": 2, ""inspect_all"": false}"
207,SHAP/Test Dataset Local Shap 25/shap_tuples_non_prefix_207.json,UNKNOWN,UNKNOWN,3,savings_status_<100,Savings account status: savings below 100 DM.,decrease_risk,-0.023918590889213144,0.023918590889213144,Investigation of savings account balances below 100 DM as a mitigating factor that reduces credit default probability and inversely influences credit risk drivers.,"**Explanation:**
Based on the provided context, there is no statistical evidence supporting the premise that savings account balances below 100 DM reduce credit default probability or inversely influence credit risk drivers. The available literature indicates that while savings-related features are occasionally included in credit scoring datasets, they frequently lack statistical significance in predictive models. Specifically, a regression-based credit risk modeling study explicitly removed the ""Savings"" variable from its final OLS model because it demonstrated neither statistical relevance nor clear theoretical importance for predicting default. Another analysis notes that savings account data is utilized as a general input feature for classifying borrowers into risk categories, but it does not report any specific coefficients or directional relationships for low balances. Consequently, the provided documents do not validate an inverse or mitigating effect for this variable. Instead, the exclusion of savings from significant predictors suggests it does not reliably lower credit risk in the analyzed datasets.

**Evidence Bullets:**
- ""Savings"" was explicitly removed from the reduced OLS model due to a lack of statistical relevance or clear theoretical importance in credit-risk modeling (Source: regression-based credit risk modeling.pdf, p. 23).
- Savings account information is listed as one of the available features used to classify clients into high-risk or low-risk groups, but no specific coefficient, correlation, or directional impact is reported (Source: The Application of Tree-based model to Unbalanced German Credit Data Analysis.pdf, p. 2).
- The provided context contains no regression coefficients, p-values, or statistical tables linking savings account balances below 100 DM to credit default probability or risk drivers.","[{""source"": ""An_Investigation_of_Credit_Card_Default_Prediction_in_the_Imbalanced_Datasets.pdf"", ""page"": 2, ""score"": 0.21380305290222168}, {""source"": ""An_Investigation_of_Credit_Card_Default_Prediction_in_the_Imbalanced_Datasets.pdf"", ""page"": 1, ""score"": 0.2143089771270752}, {""source"": ""Interest and credit risk management in German banks.pdf"", ""page"": 24, ""score"": 0.21553254127502441}, {""source"": ""Explainable Automated Machine Learning for Credit Decisions.pdf"", ""page"": 6, ""score"": 0.21673530340194702}, {""source"": ""regression-based credit risk modeling.pdf"", ""page"": 23, ""score"": 0.21802037954330444}, {""source"": ""The Application of Tree-based model to Unbalanced German Credit Data Analysis.pdf"", ""page"": 2, ""score"": 0.2188395857810974}, {""source"": ""regression-based credit risk modeling.pdf"", ""page"": 2, ""score"": 0.22095143795013428}, {""source"": ""Interest and credit risk management in German banks.pdf"", ""page"": 3, ""score"": 0.2209799885749817}, {""source"": ""Explainable Automated Machine Learning for Credit Decisions.pdf"", ""page"": 2, ""score"": 0.2270665168762207}]","[{""source"": ""An_Investigation_of_Credit_Card_Default_Prediction_in_the_Imbalanced_Datasets.pdf"", ""page"": 2, ""score"": 0.21380305290222168, ""sentence"": ""default client from non-defaulted [8] because these parame- ters may enhance the performance of models.""}, {""source"": ""An_Investigation_of_Credit_Card_Default_Prediction_in_the_Imbalanced_Datasets.pdf"", ""page"": 1, ""score"": 0.2143089771270752, ""sentence"": ""For more information, see https://creativecommons.org/licenses/by/4.0/ 201173""}, {""source"": ""Interest and credit risk management in German banks.pdf"", ""page"": 24, ""score"": 0.21553254127502441, ""sentence"": ""NIMi = α + β1 ⋅ IRRi + β2 ⋅ ImpRCST,i + β3 ⋅ Costi + γ/uF8020Xi + εi, (10)""}, {""source"": ""Explainable Automated Machine Learning for Credit Decisions.pdf"", ""page"": 6, ""score"": 0.21673530340194702, ""sentence"": ""Both accuracy and explainability are essential in aligning credit risk decisions with the dynamic demands o f the digital economy.""}, {""source"": ""regression-based credit risk modeling.pdf"", ""page"": 23, ""score"": 0.21802037954330444, ""sentence"": ""The reduced model therefore retains only variables that demonstrate statistical relevance or clear theoretical importance in credit-risk modeling.""}, {""source"": ""The Application of Tree-based model to Unbalanced German Credit Data Analysis.pdf"", ""page"": 2, ""score"": 0.2188395857810974, ""sentence"": ""and low-risk groups with the information like gender, age and savings account.""}, {""source"": ""regression-based credit risk modeling.pdf"", ""page"": 2, ""score"": 0.22095143795013428, ""sentence"": ""Checking account status and savings categories also show meaningful associ- ations with credit risk classification.""}, {""source"": ""Interest and credit risk management in German banks.pdf"", ""page"": 3, ""score"": 0.2209799885749817, ""sentence"": ""In addition, we find that the impairments in a bank’s bond portfolio are much determined by the bank’s interest rate risk and by the relative size of its bond portfolio.""}, {""source"": ""Explainable Automated Machine Learning for Credit Decisions.pdf"", ""page"": 2, ""score"": 0.2270665168762207, ""sentence"": ""Machine learning is crucial in addressing these challenges, particularly in mitigating the adverse selection problem in loan applicant evaluation (Jordan & Mitchell, 2015).""}]","{""min_docs"": 3, ""max_docs"": 20, ""min_gap"": 0.001, ""max_chunks_per_source"": 2, ""inspect_all"": false}"
