sample_idx,shap_json_path,prediction_label,prediction_probability,feature_rank,feature,feature_definition,feature_direction,feature_shap_value,feature_abs_shap,question,answer,selected_sources,evidence_sentences,retrieval_params
43,SHAP/Test Dataset Local Shap Correct/shap_tuples_non_prefix_43.json,UNKNOWN,UNKNOWN,1,checking_status_<0,Checking account status: balance below 0 DM.,increase_risk,0.08137028526102143,0.08137028526102143,Empirical analysis of the contribution of negative checking account balances to increased credit default probability.,"Based on the provided empirical analysis, negative checking account balances demonstrate a clear positive relationship with credit default probability. In the evaluated logistic regression framework, checking account status functions as a highly significant predictor of borrower risk. Specifically, applicants maintaining a checking account balance below 0 DM exhibit a substantially higher estimated likelihood of being classified as bad credit risks when compared to the baseline reference group. This directional impact confirms that liquidity deficits or existing overdraft positions materially elevate default probability. The statistical models consistently rank this variable among the most important discriminators, underscoring its reliability in quantifying financial distress. Consequently, negative balances serve as a robust empirical indicator for heightened credit risk in automated lending decisions.

**Evidence Bullets:**
- **Direction & Significance:** Applicants with a checking account balance below 0 DM show a substantially higher estimated risk of bad credit classification, confirming a positive impact on default probability (Source: regression-based credit risk modeling.pdf, p. 29).
- **Model Importance:** Checking account status emerges as an important discriminator in the logistic regression model, indicating statistical significance in predicting credit risk (Source: regression-based credit risk modeling.pdf, p. 29).
- **Reference Baseline:** The risk elevation is measured against a reference group of applicants with checking account balances exceeding 200 DM, highlighting the relative risk premium associated with negative balances (Source: regression-based credit risk modeling.pdf, p. 26).","[{""source"": ""regression-based credit risk modeling.pdf"", ""page"": 26, ""score"": 0.21076446771621704}, {""source"": ""regression-based credit risk modeling.pdf"", ""page"": 29, ""score"": 0.21442294120788574}, {""source"": ""Explainable Automated Machine Learning for Credit Decisions.pdf"", ""page"": 6, ""score"": 0.21710532903671265}, {""source"": ""An_Investigation_of_Credit_Card_Default_Prediction_in_the_Imbalanced_Datasets.pdf"", ""page"": 5, ""score"": 0.21883505582809448}, {""source"": ""An_Investigation_of_Credit_Card_Default_Prediction_in_the_Imbalanced_Datasets.pdf"", ""page"": 2, ""score"": 0.22305482625961304}, {""source"": ""Interest and credit risk management in German banks.pdf"", ""page"": 16, ""score"": 0.22324669361114502}, {""source"": ""The Application of Tree-based model to Unbalanced German Credit Data Analysis.pdf"", ""page"": 2, ""score"": 0.22344565391540527}]","[{""source"": ""regression-based credit risk modeling.pdf"", ""page"": 26, ""score"": 0.21076446771621704, ""sentence"": ""The checking accountStatusvariable uses applicants with more than 200 DM (Deutsche""}, {""source"": ""regression-based credit risk modeling.pdf"", ""page"": 29, ""score"": 0.21442294120788574, ""sentence"": ""Applicants with a checking account balance below 0 DM (Deutsche Mark) exhibit a substantially higher estimated risk relative to the reference group, while the category of no checking account is associated with a lower estimated risk in this""}, {""source"": ""Explainable Automated Machine Learning for Credit Decisions.pdf"", ""page"": 6, ""score"": 0.21710532903671265, ""sentence"": ""Both accuracy and explainability are essential in aligning credit risk decisions with the dynamic demands o f the digital economy.""}, {""source"": ""An_Investigation_of_Credit_Card_Default_Prediction_in_the_Imbalanced_Datasets.pdf"", ""page"": 5, ""score"": 0.21883505582809448, ""sentence"": ""T.""}, {""source"": ""An_Investigation_of_Credit_Card_Default_Prediction_in_the_Imbalanced_Datasets.pdf"", ""page"": 2, ""score"": 0.22305482625961304, ""sentence"": ""The stan- dard model depends on the ﬁnancial ratios, income account, and data on the balance sheet [6], [7].""}, {""source"": ""Interest and credit risk management in German banks.pdf"", ""page"": 16, ""score"": 0.22324669361114502, ""sentence"": ""The sign of the respective coefficients remains negative although""}, {""source"": ""The Application of Tree-based model to Unbalanced German Credit Data Analysis.pdf"", ""page"": 2, ""score"": 0.22344565391540527, ""sentence"": ""However, there are two unique features in credit evaluation analysis.""}]","{""min_docs"": 3, ""max_docs"": 20, ""min_gap"": 0.001, ""max_chunks_per_source"": 2, ""inspect_all"": false}"
43,SHAP/Test Dataset Local Shap Correct/shap_tuples_non_prefix_43.json,UNKNOWN,UNKNOWN,2,checking_status_no checking,Checking account status: no checking account.,increase_risk,0.06402616457343625,0.06402616457343625,Statistical impact of the absence of a checking account on the likelihood of loan default.,"Based on the provided context, the specific statistical impact of the absence of a checking account on the likelihood of loan default cannot be quantified. The excerpts confirm that ""Status of existing checking account"" is utilized as a qualitative predictor (Attribute 1) in the German credit dataset, but the provided text does not include any regression coefficients, p-values, or model output tables that quantify its relationship with credit risk. Without these empirical results, it is impossible to determine whether lacking a checking account exerts a positive or negative directional effect on default probability, nor can its statistical significance be verified. The available material functions solely as a feature dictionary rather than a results summary, omitting the necessary statistical metrics to evaluate risk direction. Consequently, while the variable is established as a standard input for credit assessment models, its precise coefficient and significance level remain unreported in the given excerpts. A complete analysis would require access to the full regression output or coefficient tables from the original study.

- ""Status of existing checking account"" is explicitly documented as Attribute 1 in the German dataset feature table, categorized as a qualitative predictor (Source 3, page 3).
- The provided context lacks regression coefficients, odds ratios, or p-values for this attribute, preventing any determination of its directional impact or statistical significance on loan default (Source 3, page 3).
- Neither of the other provided excerpts discuss checking account status or supply alternative statistical metrics that would quantify its relationship with credit risk (Source 1, page 23; Source 2, page 8).","[{""source"": ""An_Investigation_of_Credit_Card_Default_Prediction_in_the_Imbalanced_Datasets.pdf"", ""page"": 23, ""score"": 0.2348737120628357}, {""source"": ""Comparison of the impact of dimensionality reduction and data splitting on classification performance in credit risk assessment .pdf"", ""page"": 8, ""score"": 0.24347925186157227}, {""source"": ""Investigation and improvement of multi-layer perceptron neural.pdf"", ""page"": 3, ""score"": 0.2446569800376892}]","[{""source"": ""An_Investigation_of_Credit_Card_Default_Prediction_in_the_Imbalanced_Datasets.pdf"", ""page"": 23, ""score"": 0.2348737120628357, ""sentence"": ""This low-productivity, signiﬁcant expense conjectures cannot meet consumer ﬁnance enterprise’s credit""}, {""source"": ""Comparison of the impact of dimensionality reduction and data splitting on classification performance in credit risk assessment .pdf"", ""page"": 8, ""score"": 0.24347925186157227, ""sentence"": ""Arslan 252 Page 8 of 23 loan default.""}, {""source"": ""Investigation and improvement of multi-layer perceptron neural.pdf"", ""page"": 3, ""score"": 0.2446569800376892, ""sentence"": ""Number Description Class Attribute 1 Status of existing checking account Qualitative Attribute 2 Duration in month Numerical Attribute 3 Credit history Qualitative Attribute 4 Purpose Qualitative Attribute 5 Credit amount Numerical Attribute 6 Savings account/bonds Qualitative Attribute 7 Present employment since Qualitative Attribute 8 Instalment rate in percentage of disposable income Numerical Attribute 9 Personal status and sex Qualitative Attribute 10 Other debtors/guarantors Qualitative Attribute 11 Present residence since Numerical Attribute 12 Property Qualitative Attribute 13 Age in years Numerical Attribute 14 Other instalment plans Qualitative attribute 15 Housing Qualitative""}]","{""min_docs"": 3, ""max_docs"": 20, ""min_gap"": 0.001, ""max_chunks_per_source"": 2, ""inspect_all"": false}"
43,SHAP/Test Dataset Local Shap Correct/shap_tuples_non_prefix_43.json,UNKNOWN,UNKNOWN,3,credit_history_no credits/all paid,Credit history: no credits taken or all previous credits paid back duly.,increase_risk,0.047464904264771214,0.047464904264771214,Investigation into how a lack of credit history or fully settled past credits contributes to elevated credit risk profiles.,"Based on the provided context, the specific variables ""lack of credit history"" and ""fully settled past credits"" are not explicitly analyzed or reported in the regression outputs. However, the excerpts do evaluate closely related financial indicators that serve as proxies for creditworthiness and payment capacity. Checking account status and savings categories are highlighted as meaningful predictors of credit risk classification, though their exact directional coefficients are not quantified in the text. The ""Number of credits"" variable was initially included but subsequently removed from the reduced OLS model because it failed to demonstrate sufficient statistical relevance or theoretical importance. In contrast, loan terms such as longer durations, larger credit amounts, and higher installment rates exhibit a clear positive association with bad credit risk, significantly elevating default probability. Additionally, existing high credit limits act as a protective factor, making future payment failures less likely, while demographic factors like age demonstrate a statistically significant negative association with risk. Ultimately, the models prioritize current account balances, loan structuring, and existing credit exposure over historical credit settlement patterns when estimating default likelihood.

**Evidence Bullets:**
- Checking account status and savings categories show meaningful associations with credit risk classification, serving as key financial health indicators (Source: regression-based credit risk modeling.pdf, page 2).
- The ""Number of credits"" variable was excluded from the final reduced model, which retained only statistically relevant predictors and achieved an R² of 0.24 (Adj. R² = 0.22) (Source: regression-based credit risk modeling.pdf, page 23).
- Longer loan durations, larger credit amounts, and higher installment rates are positively associated with a higher likelihood of being classified as a bad credit risk (Source: regression-based credit risk modeling.pdf, page 2).
- Existing high credit limits are negatively associated with default probability, as clients with higher limits are deemed less likely to fail to pay owed amounts (Source: An_Investigation_of_Credit_Card_Default_Prediction_in_the_Imbalanced_Datasets.pdf, page 24).
- Age demonstrates a statistically significant negative association with credit risk in the reduced logistic model, while foreign worker status shows a strong positive association with higher estimated risk (Source: regression-based credit risk modeling.pdf, page 2).","[{""source"": ""regression-based credit risk modeling.pdf"", ""page"": 2, ""score"": 0.18908071517944336}, {""source"": ""regression-based credit risk modeling.pdf"", ""page"": 23, ""score"": 0.1952122449874878}, {""source"": ""An_Investigation_of_Credit_Card_Default_Prediction_in_the_Imbalanced_Datasets.pdf"", ""page"": 24, ""score"": 0.1997707486152649}, {""source"": ""The Application of Tree-based model to Unbalanced German Credit Data Analysis.pdf"", ""page"": 2, ""score"": 0.2009732723236084}]","[{""source"": ""regression-based credit risk modeling.pdf"", ""page"": 2, ""score"": 0.18908071517944336, ""sentence"": ""cants are the strongest predictors of credit risk.""}, {""source"": ""regression-based credit risk modeling.pdf"", ""page"": 23, ""score"": 0.1952122449874878, ""sentence"": ""Even after exclusions, the reduced OLS model still shows limited explanatory power, with an R2 of 0.24 (Adj.R 2 =0.22) and a lower but still elevated condition number (=3.78×10 4).""}, {""source"": ""An_Investigation_of_Credit_Card_Default_Prediction_in_the_Imbalanced_Datasets.pdf"", ""page"": 24, ""score"": 0.1997707486152649, ""sentence"": ""We tried our best to make a thorough analysis, and there are still a few possible""}, {""source"": ""The Application of Tree-based model to Unbalanced German Credit Data Analysis.pdf"", ""page"": 2, ""score"": 0.2009732723236084, ""sentence"": ""Simply speaking, we want to build a model to classify clients into high-risk groups who are more likely to default or low-risk groups who are more reliable, with some available information data in banking system.""}]","{""min_docs"": 3, ""max_docs"": 20, ""min_gap"": 0.001, ""max_chunks_per_source"": 2, ""inspect_all"": false}"
