sample_idx,shap_json_path,true_label,prediction_label,prediction_probability,feature_rank,feature,feature_definition,feature_direction,feature_shap_value,feature_abs_shap,question,answer,selected_sources,evidence_sentences,retrieval_params
248,SHAP/Test Dataset Local Shap 25/shap_tuples_non_prefix_248.json,GOOD CREDIT RISK,GOOD CREDIT RISK,0.7914935462586294,1,checking_status_no checking,Checking account status: no checking account.,decrease_risk,-0.06600111975171524,0.06600111975171524,Empirical analysis of the absence of a checking account as a mitigating factor among the determinants of default in consumer credit portfolios.,"Based on the provided empirical analysis, the absence of a checking account functions as a mitigating factor for credit risk. The regression results explicitly indicate that applicants categorized as having ""no checking account"" are associated with a lower estimated risk of default within the analyzed dataset. This finding confirms a negative directional relationship between checking account status and default probability, directly supporting the premise that its absence reduces credit risk in this specific consumer credit portfolio. While the study notes that demographic predictors are generally less informative than financial variables, the checking account variable demonstrates a clear risk-reducing effect. It is important to note that the provided excerpt does not report exact regression coefficients or p-values for this specific category, but the directional finding is explicitly stated as a meaningful model output. Consequently, financial institutions utilizing this dataset should interpret a lack of checking account history as a favorable indicator for creditworthiness.

**Evidence Bullets:**
- ""No checking account"" is associated with a lower estimated risk of default (Source: regression-based credit risk modeling.pdf, p. 29).
- The text does not provide a specific numerical coefficient or p-value for this variable, but explicitly confirms its negative association with credit risk in the analyzed dataset (Source: regression-based credit risk modeling.pdf, p. 29).
- Age shows a statistically significant, modest negative association with credit risk, indicating older applicants are less likely to be classified as bad credit risks (Source: regression-based credit risk modeling.pdf, p. 29).","[{""source"": ""An_Investigation_of_Credit_Card_Default_Prediction_in_the_Imbalanced_Datasets.pdf"", ""page"": 23, ""score"": 0.20429617166519165}, {""source"": ""regression-based credit risk modeling.pdf"", ""page"": 29, ""score"": 0.21605956554412842}, {""source"": ""An_Investigation_of_Credit_Card_Default_Prediction_in_the_Imbalanced_Datasets.pdf"", ""page"": 2, ""score"": 0.21875083446502686}]","[{""source"": ""An_Investigation_of_Credit_Card_Default_Prediction_in_the_Imbalanced_Datasets.pdf"", ""page"": 23, ""score"": 0.20429617166519165, ""sentence"": ""This low-productivity, signiﬁcant expense conjectures cannot meet consumer ﬁnance enterprise’s credit""}, {""source"": ""regression-based credit risk modeling.pdf"", ""page"": 29, ""score"": 0.21605956554412842, ""sentence"": ""while the category of no checking account is associated with a lower estimated risk in this dataset.""}, {""source"": ""An_Investigation_of_Credit_Card_Default_Prediction_in_the_Imbalanced_Datasets.pdf"", ""page"": 2, ""score"": 0.21875083446502686, ""sentence"": ""default client from non-defaulted [8] because these parame- ters may enhance the performance of models.""}]","{""min_docs"": 3, ""max_docs"": 20, ""min_gap"": 0.001, ""max_chunks_per_source"": 2, ""inspect_all"": false}"
248,SHAP/Test Dataset Local Shap 25/shap_tuples_non_prefix_248.json,GOOD CREDIT RISK,GOOD CREDIT RISK,0.7914935462586294,2,duration,Loan duration in months.,decrease_risk,-0.03257374664067534,0.03257374664067534,Statistical evaluation of loan tenure duration as a credit risk driver that correlates with reduced borrower default probability.,"Based on the provided context, loan tenure duration (labeled as ""Duration"") functions as a significant positive driver of credit risk, directly contradicting the premise that it correlates with reduced default probability. The regression-based modeling explicitly identifies Duration as a key risk indicator within financial capacity and credit history metrics. Empirical findings indicate that longer loan tenures are positively associated with an increased likelihood of credit risk. This directional relationship aligns with established theoretical expectations in credit scoring, where extended repayment periods typically amplify a lender's exposure to borrower default over time. Consequently, rather than mitigating risk, Duration demonstrates a clear positive impact, meaning that as the loan term lengthens, the probability of default rises. This underscores the necessity of treating loan tenure length as a critical positive predictor in interpretable regression frameworks. The analysis confirms that financial variables like Duration hold substantial predictive power for credit risk assessment.

**Evidence Bullets:**
- Duration is explicitly identified as a key risk indicator, with longer tenures positively increasing the likelihood of credit risk (regression-based credit risk modeling.pdf, p. 23).
- The positive association between extended loan duration and default probability is noted as corresponding to established theoretical expectations in credit scoring literature (regression-based credit risk modeling.pdf, p. 23).
- Duration is listed alongside Credit amount and Installment rate as a primary predictor in the ordinary least squares (OLS) regression analysis used to benchmark credit risk (regression-based credit risk modeling.pdf, p. 23).","[{""source"": ""An_Investigation_of_Credit_Card_Default_Prediction_in_the_Imbalanced_Datasets.pdf"", ""page"": 1, ""score"": 0.1901194453239441}, {""source"": ""regression-based credit risk modeling.pdf"", ""page"": 7, ""score"": 0.1938353180885315}, {""source"": ""regression-based credit risk modeling.pdf"", ""page"": 23, ""score"": 0.20699316263198853}]","[{""source"": ""An_Investigation_of_Credit_Card_Default_Prediction_in_the_Imbalanced_Datasets.pdf"", ""page"": 1, ""score"": 0.1901194453239441, ""sentence"": ""ﬁnancial organizations, loan institutes, and other decision-makers to predict the loan defaulter earlier.""}, {""source"": ""regression-based credit risk modeling.pdf"", ""page"": 7, ""score"": 0.1938353180885315, ""sentence"": ""Empirical work has exam- ined how demographic characteristics, such as age and marital status, and loan terms, such as loan size and interest rate, affect the borrower’s ability to repay on time (Özdemir, 2008).""}, {""source"": ""regression-based credit risk modeling.pdf"", ""page"": 23, ""score"": 0.20699316263198853, ""sentence"": ""These findings confirm that the reduced model serves as an effective descriptive benchmark.""}]","{""min_docs"": 3, ""max_docs"": 20, ""min_gap"": 0.001, ""max_chunks_per_source"": 2, ""inspect_all"": false}"
248,SHAP/Test Dataset Local Shap 25/shap_tuples_non_prefix_248.json,GOOD CREDIT RISK,GOOD CREDIT RISK,0.7914935462586294,3,checking_status_<0,Checking account status: balance below 0 DM.,decrease_risk,-0.028163776068459108,0.028163776068459108,Investigation into the role of negative checking account balances as a protective indicator for lower credit default risk.,"Based on the provided regression analysis, the premise that negative checking account balances serve as a protective indicator for lower credit default risk is directly contradicted by the empirical findings. The context explicitly states that applicants with a checking account balance below 0 DM exhibit a substantially higher estimated risk relative to the reference group, indicating a positive association with credit risk rather than a protective effect. While the absence of a checking account is noted as being associated with lower estimated risk in this specific dataset, this is a distinct categorical variable from having a negative balance. The regression models identify checking account status as a critical discriminator for predicting bad credit risk, with negative balances signaling increased default probability. Consequently, rather than mitigating risk, maintaining a negative checking account balance in this context functions as a risk-enhancing factor. This aligns with standard financial intuition, where negative balances typically reflect overdraft usage or liquidity constraints, thereby elevating the likelihood of default.

**Evidence Bullets:**
- Checking account balance < 0 DM is associated with a substantially higher estimated credit risk relative to the reference group (Source: regression-based credit risk modeling.pdf, p. 29).
- The ""no checking account"" category is separately identified as being associated with a lower estimated risk in this dataset, distinguishing it from negative balances (Source: regression-based credit risk modeling.pdf, p. 29).
- Checking account status is highlighted as an important discriminator in the logistic model, though exact regression coefficients and p-values are not numerically specified in the provided text (Source: regression-based credit risk modeling.pdf, p. 29).","[{""source"": ""regression-based credit risk modeling.pdf"", ""page"": 29, ""score"": 0.22723644971847534}, {""source"": ""regression-based credit risk modeling.pdf"", ""page"": 29, ""score"": 0.23700952529907227}]","[{""source"": ""regression-based credit risk modeling.pdf"", ""page"": 29, ""score"": 0.22723644971847534, ""sentence"": ""while the category of no checking account is associated with a lower estimated risk in this dataset.""}, {""source"": ""regression-based credit risk modeling.pdf"", ""page"": 29, ""score"": 0.23700952529907227, ""sentence"": ""Applicants with a checking account balance below 0 DM (Deutsche Mark) exhibit a substantially higher estimated risk relative to the reference group, while the category of no checking account is associated with a lower estimated risk in this""}]","{""min_docs"": 3, ""max_docs"": 20, ""min_gap"": 0.001, ""max_chunks_per_source"": 2, ""inspect_all"": false}"
