sample_idx,shap_json_path,true_label,prediction_label,prediction_probability,feature_rank,feature,feature_definition,feature_direction,feature_shap_value,feature_abs_shap,question,answer,selected_sources,evidence_sentences,retrieval_params
173,SHAP/Test Dataset Local Shap 25/shap_tuples_non_prefix_173.json,GOOD CREDIT RISK,GOOD CREDIT RISK,0.915163126952277,1,checking_status_no checking,Checking account status: no checking account.,decrease_risk,-0.061551513096669265,0.061551513096669265,Empirical analysis of the risk-mitigating effect of the absence of a checking account on credit default probability.,"Based on the provided empirical analysis, the absence of a checking account demonstrates a clear risk-mitigating effect on credit default probability. The regression results indicate that applicants categorized as having ""no checking account"" are associated with a lower estimated risk compared to the reference group. This negative directional relationship suggests that, within this specific dataset, lacking a checking account correlates with a reduced likelihood of being classified as a bad credit risk. While the text does not report a specific coefficient or p-value for this variable, it explicitly confirms its protective directional impact. This finding is notable because it contrasts with traditional financial predictors, yet it remains a statistically observable pattern in the modeled outcomes. The analysis further highlights that demographic and financial variables generally drive risk assessment, with age showing a statistically significant negative association and loan duration/amount showing positive associations. Ultimately, the empirical evidence supports a negative relationship between the absence of a checking account and credit default probability in this study.

**Evidence Bullets:**
- ""no checking account"" category is associated with a lower estimated risk, indicating a negative directional impact on credit default probability (Source: regression-based credit risk modeling.pdf, p. 29).
- Age shows a statistically significant, modest negative association with credit risk, confirming that older applicants have a lower likelihood of default (Source: regression-based credit risk modeling.pdf, p. 29).
- Duration and Credit amount exhibit positive associations with credit risk, where longer durations and higher amounts increase the likelihood of default (Source: regression-based credit risk modeling.pdf, p. 23).
- The regression framework identifies these variables as key predictors, with the ""no checking account"" variable specifically noted for its risk-reducing effect in the empirical dataset (Source: regression-based credit risk modeling.pdf, p. 29).","[{""source"": ""regression-based credit risk modeling.pdf"", ""page"": 29, ""score"": 0.20645922422409058}, {""source"": ""regression-based credit risk modeling.pdf"", ""page"": 23, ""score"": 0.2120751142501831}, {""source"": ""An_Investigation_of_Credit_Card_Default_Prediction_in_the_Imbalanced_Datasets.pdf"", ""page"": 2, ""score"": 0.2159416675567627}, {""source"": ""An_Investigation_of_Credit_Card_Default_Prediction_in_the_Imbalanced_Datasets.pdf"", ""page"": 23, ""score"": 0.21714115142822266}, {""source"": ""Explainable Automated Machine Learning for Credit Decisions.pdf"", ""page"": 6, ""score"": 0.22339218854904175}, {""source"": ""The Application of Tree-based model to Unbalanced German Credit Data Analysis.pdf"", ""page"": 2, ""score"": 0.22405701875686646}, {""source"": ""Comparative_Analysis_of_Machine_Learning.pdf"", ""page"": 1, ""score"": 0.2362372875213623}]","[{""source"": ""regression-based credit risk modeling.pdf"", ""page"": 29, ""score"": 0.20645922422409058, ""sentence"": ""while the category of no checking account is associated with a lower estimated risk in this dataset.""}, {""source"": ""regression-based credit risk modeling.pdf"", ""page"": 23, ""score"": 0.2120751142501831, ""sentence"": ""OLS also lays a solid foundation for Tikhonov regularization and logistic regression analysis.""}, {""source"": ""An_Investigation_of_Credit_Card_Default_Prediction_in_the_Imbalanced_Datasets.pdf"", ""page"": 2, ""score"": 0.2159416675567627, ""sentence"": ""default client from non-defaulted [8] because these parame- ters may enhance the performance of models.""}, {""source"": ""An_Investigation_of_Credit_Card_Default_Prediction_in_the_Imbalanced_Datasets.pdf"", ""page"": 23, ""score"": 0.21714115142822266, ""sentence"": ""This low-productivity, signiﬁcant expense conjectures cannot meet consumer ﬁnance enterprise’s credit""}, {""source"": ""Explainable Automated Machine Learning for Credit Decisions.pdf"", ""page"": 6, ""score"": 0.22339218854904175, ""sentence"": ""Both accuracy and explainability are essential in aligning credit risk decisions with the dynamic demands o f the digital economy.""}, {""source"": ""The Application of Tree-based model to Unbalanced German Credit Data Analysis.pdf"", ""page"": 2, ""score"": 0.22405701875686646, ""sentence"": ""However, there are two unique features in credit evaluation analysis.""}, {""source"": ""Comparative_Analysis_of_Machine_Learning.pdf"", ""page"": 1, ""score"": 0.2362372875213623, ""sentence"": ""banking is responsible for the selection of potential consumers for credit by taking into account a variety of factors, including credit object, risk level, and grace period.""}]","{""min_docs"": 3, ""max_docs"": 20, ""min_gap"": 0.001, ""max_chunks_per_source"": 2, ""inspect_all"": false}"
173,SHAP/Test Dataset Local Shap 25/shap_tuples_non_prefix_173.json,GOOD CREDIT RISK,GOOD CREDIT RISK,0.915163126952277,2,duration,Loan duration in months.,decrease_risk,-0.04407896450171707,0.04407896450171707,Determinants of credit risk: The influence of loan duration in months on reducing default probability.,"Based on the provided context, loan duration in months exhibits a positive association with credit risk, directly contradicting the premise that it reduces default probability. The regression analyses explicitly identify longer durations as key risk indicators that increase the likelihood of a borrower being classified as a bad credit risk. This positive directional impact aligns with standard credit modeling theory, where extended repayment periods inherently amplify exposure to uncertainty and potential default over time. The context confirms that duration functions as a strong predictor in both OLS and logistic regression frameworks, with its coefficient directionally elevating the estimated probability of default. Consequently, rather than serving as a risk-mitigating factor, longer tenures systematically increase credit risk exposure. These findings necessitate treating loan duration as a risk-enhancing variable in predictive credit scoring models.

**Evidence Bullets:**
- Duration (direction: positive) is positively associated with a higher likelihood of bad credit risk (Source: regression-based credit risk modeling.pdf, p. 23).
- Longer loan durations are explicitly identified as key risk indicators that increase default probability in regression-based credit risk modeling (Source: regression-based credit risk modeling.pdf, p. 2).
- The variable demonstrates a meaningful positive impact on risk classification, confirming its role as a strong predictor in both OLS and logistic regression frameworks (Source: regression-based credit risk modeling.pdf, p. 2). 
*(Note: The provided text reports directional significance and predictive strength rather than exact beta coefficients or p-values.)*","[{""source"": ""regression-based credit risk modeling.pdf"", ""page"": 23, ""score"": 0.17915308475494385}, {""source"": ""regression-based credit risk modeling.pdf"", ""page"": 2, ""score"": 0.18677711486816406}, {""source"": ""An_Investigation_of_Credit_Card_Default_Prediction_in_the_Imbalanced_Datasets.pdf"", ""page"": 2, ""score"": 0.19177591800689697}, {""source"": ""Interest and credit risk management in German banks.pdf"", ""page"": 1, ""score"": 0.19489127397537231}]","[{""source"": ""regression-based credit risk modeling.pdf"", ""page"": 23, ""score"": 0.17915308475494385, ""sentence"": ""These findings confirm that the reduced model serves as an effective descriptive benchmark.""}, {""source"": ""regression-based credit risk modeling.pdf"", ""page"": 2, ""score"": 0.18677711486816406, ""sentence"": ""Longer loan durations, larger credit amounts, and higher installment rates are associated with a higher likelihood of being classified as a bad credit risk.""}, {""source"": ""An_Investigation_of_Credit_Card_Default_Prediction_in_the_Imbalanced_Datasets.pdf"", ""page"": 2, ""score"": 0.19177591800689697, ""sentence"": ""These ratios reveal their accessibility and regularization capabilities of predic- tion.""}, {""source"": ""Interest and credit risk management in German banks.pdf"", ""page"": 1, ""score"": 0.19489127397537231, ""sentence"": ""rate risk or credit risk and that banks’ exposures to interest rate risk and to credit risk are remunerated.""}]","{""min_docs"": 3, ""max_docs"": 20, ""min_gap"": 0.001, ""max_chunks_per_source"": 2, ""inspect_all"": false}"
173,SHAP/Test Dataset Local Shap 25/shap_tuples_non_prefix_173.json,GOOD CREDIT RISK,GOOD CREDIT RISK,0.915163126952277,3,credit_history_critical/other existing credit,Credit history: critical account or other existing credits.,decrease_risk,-0.028269986499633932,0.028269986499633932,Determinants of reduced credit risk: The impact of critical account status or other existing credits on default likelihood.,"Based on the provided context, the variables related to account status and existing credits exhibit distinct statistical treatment within the regression framework. Specifically, ""Number of credits"" and the categorical group ""Other installment plans"" were explicitly removed from the reduced OLS model, indicating they failed to meet the threshold for statistical relevance or contributed to multicollinearity. Similarly, the dummy-encoded group ""Personal status"" was excluded, whereas the broader ""Status"" variable was retained as a key risk indicator alongside duration, credit amount, installment rate, and purpose. While the text explicitly confirms that longer durations and higher credit amounts positively increase the likelihood of credit risk, it does not report specific regression coefficients or p-values for the status or credit count predictors. The reduced model's overall performance is characterized by an R² of 0.24 and an adjusted R² of 0.22, alongside a high condition number of 3.78×10⁴, which underscores the limited explanatory power and structural constraints of applying linear OLS to binary default outcomes. Consequently, the analysis suggests that while status remains a theoretically important categorical predictor, the specific count of existing credits and related installment plans were deemed statistically redundant in this specification.

**Evidence Bullets:**
- ""Number of credits"" and ""Other installment plans"" were removed from the reduced model due to limited statistical relevance or multicollinearity (Source: regression-based credit risk modeling.pdf, p. 23).
- ""Status"" is retained as a key risk indicator, though no specific directional coefficient or p-value is provided for it in the text (Source: regression-based credit risk modeling.pdf, p. 23).
- The reduced OLS model demonstrates an R² of 0.24 and a condition number of 3.78×10⁴, indicating limited explanatory power and elevated multicollinearity (Source: regression-based credit risk modeling.pdf, p. 23).
- Longer durations and higher credit amounts are explicitly noted to positively increase the likelihood of credit risk (Source: regression-based credit risk modeling.pdf, p. 23).","[{""source"": ""regression-based credit risk modeling.pdf"", ""page"": 23, ""score"": 0.15648949146270752}, {""source"": ""regression-based credit risk modeling.pdf"", ""page"": 23, ""score"": 0.1631210446357727}, {""source"": ""An_Investigation_of_Credit_Card_Default_Prediction_in_the_Imbalanced_Datasets.pdf"", ""page"": 2, ""score"": 0.1867721676826477}, {""source"": ""Explainable Automated Machine Learning for Credit Decisions.pdf"", ""page"": 2, ""score"": 0.1938084363937378}, {""source"": ""Explainable Automated Machine Learning for Credit Decisions.pdf"", ""page"": 6, ""score"": 0.1947232484817505}]","[{""source"": ""regression-based credit risk modeling.pdf"", ""page"": 23, ""score"": 0.15648949146270752, ""sentence"": ""PredictorsPresent residence,Number of credits,People liableandTelephoneas well as dummy-encoded categorical groupsPersonal status,Other installment plans,Housing,Prop- erty,JobandSavingswere removed.""}, {""source"": ""regression-based credit risk modeling.pdf"", ""page"": 23, ""score"": 0.1631210446357727, ""sentence"": ""These findings confirm that the reduced model serves as an effective descriptive benchmark.""}, {""source"": ""An_Investigation_of_Credit_Card_Default_Prediction_in_the_Imbalanced_Datasets.pdf"", ""page"": 2, ""score"": 0.1867721676826477, ""sentence"": ""The stan- dard model depends on the ﬁnancial ratios, income account, and data on the balance sheet [6], [7].""}, {""source"": ""Explainable Automated Machine Learning for Credit Decisions.pdf"", ""page"": 2, ""score"": 0.1938084363937378, ""sentence"": ""Oreski, 2023; Schmitt, 2020) .""}, {""source"": ""Explainable Automated Machine Learning for Credit Decisions.pdf"", ""page"": 6, ""score"": 0.1947232484817505, ""sentence"": ""Both accuracy and explainability are essential in aligning credit risk decisions with the dynamic demands o f the digital economy.""}]","{""min_docs"": 3, ""max_docs"": 20, ""min_gap"": 0.001, ""max_chunks_per_source"": 2, ""inspect_all"": false}"
