sample_idx,shap_json_path,prediction_label,prediction_probability,feature_rank,feature,feature_definition,feature_direction,feature_shap_value,feature_abs_shap,question,answer,selected_sources,evidence_sentences,retrieval_params
206,SHAP/Test Dataset Local Shap 25/shap_tuples_non_prefix_206.json,UNKNOWN,UNKNOWN,1,checking_status_no checking,Checking account status: no checking account.,decrease_risk,-0.0613841674590516,0.0613841674590516,Empirical analysis of how the absence of a checking account correlates with reduced default probability in consumer credit portfolios.,"Based on the provided academic context, the absence of a checking account exhibits a negative association with credit risk, empirically correlating with a lower estimated default probability. The regression analysis explicitly identifies the ""no checking account"" category as being linked to reduced risk compared to the reference group within this specific dataset. Although the excerpt does not report a specific regression coefficient or p-value for this dummy variable, the directional finding is unambiguously stated as a risk-reducing factor. This result indicates that, within this particular portfolio, applicants lacking a checking account demonstrate a more favorable credit profile than the baseline group. The model also notes that other predictors, such as age and savings levels, carry statistically significant weight, whereas the checking account variable's impact is isolated to this specific negative risk direction. Consequently, the empirical evidence confirms that the absence of a checking account is associated with a decreased likelihood of default in the analyzed consumer credit portfolio.

**Evidence Bullets:**
- ""No checking account"" category is associated with a lower estimated risk (Source: regression-based credit risk modeling.pdf, p. 29).
- Age shows a statistically significant, modest negative association with credit risk (Source: regression-based credit risk modeling.pdf, p. 29).
- Lower savings categories are associated with higher estimated risk, though statistical significance varies across levels (Source: regression-based credit risk modeling.pdf, p. 29).
- The reduced OLS model retains variables demonstrating statistical relevance, with an R² of 0.24 (Adj.R² = 0.22) (Source: regression-based credit risk modeling.pdf, p. 23).","[{""source"": ""regression-based credit risk modeling.pdf"", ""page"": 29, ""score"": 0.19297772645950317}, {""source"": ""regression-based credit risk modeling.pdf"", ""page"": 23, ""score"": 0.20614027976989746}, {""source"": ""An_Investigation_of_Credit_Card_Default_Prediction_in_the_Imbalanced_Datasets.pdf"", ""page"": 23, ""score"": 0.21260696649551392}]","[{""source"": ""regression-based credit risk modeling.pdf"", ""page"": 29, ""score"": 0.19297772645950317, ""sentence"": ""while the category of no checking account is associated with a lower estimated risk in this dataset.""}, {""source"": ""regression-based credit risk modeling.pdf"", ""page"": 23, ""score"": 0.20614027976989746, ""sentence"": ""The reduced model therefore retains only variables that demonstrate statistical relevance or clear theoretical importance in credit-risk modeling.""}, {""source"": ""An_Investigation_of_Credit_Card_Default_Prediction_in_the_Imbalanced_Datasets.pdf"", ""page"": 23, ""score"": 0.21260696649551392, ""sentence"": ""This low-productivity, signiﬁcant expense conjectures cannot meet consumer ﬁnance enterprise’s credit""}]","{""min_docs"": 3, ""max_docs"": 20, ""min_gap"": 0.001, ""max_chunks_per_source"": 2, ""inspect_all"": false}"
206,SHAP/Test Dataset Local Shap 25/shap_tuples_non_prefix_206.json,UNKNOWN,UNKNOWN,2,credit_history_critical/other existing credit,Credit history: critical account or other existing credits.,decrease_risk,-0.03342155415003093,0.03342155415003093,Determinants of default risk: empirical evidence on how maintaining critical or diversified existing credit accounts mitigates loan delinquency rates.,"Based strictly on the provided context, there is no empirical evidence, regression output, or statistical analysis addressing the specific variable of ""maintaining critical or diversified existing credit accounts"" or its directional impact on loan delinquency rates. The text primarily establishes the macroeconomic urgency of rising credit defaults and delinquencies, emphasizing that financial institutions require accurate risk prediction models to classify borrowers. While it notes that traditional credit risk models rely on financial ratios, income account data, and balance sheet information to separate defaulters from non-defaulters, it does not report any regression coefficients, p-values, or statistical significance metrics for these or any other predictors. Consequently, the context does not quantify whether diversified credit accounts reduce delinquency (negative impact) or increase default probability (positive impact). The excerpts focus on the methodological framework and the need for Explainable AI rather than presenting empirical regression results. Therefore, the relationship between existing credit account diversification and delinquency mitigation cannot be determined from the provided text.

**Evidence Bullets:**
- Standard credit risk models utilize financial ratios, income account data, and balance sheet information as primary predictors to classify default versus non-default borrowers, but no specific coefficients or significance levels are reported (Source: An_Investigation_of_Credit_Card_Default_Prediction_in_the_Imbalanced_Datasets.pdf, p. 2).
- Credit risk is defined as the likelihood of delayed credit repayment, and delinquency rates are highlighted as a key indicator of institutional financial loss, yet no statistical tables or regression outputs are provided (Source: An_Investigation_of_Credit_Card_Default_Prediction_in_the_Imbalanced_Datasets.pdf, p. 2).
- The study emphasizes improving model accuracy and integrating Explainable AI for credit decisions, but does not report empirical results or statistical values linking existing credit account types to delinquency mitigation (Source: Explainable Automated Machine Learning for Credit Decisions.pdf, p. 6).","[{""source"": ""An_Investigation_of_Credit_Card_Default_Prediction_in_the_Imbalanced_Datasets.pdf"", ""page"": 2, ""score"": 0.159410297870636}, {""source"": ""An_Investigation_of_Credit_Card_Default_Prediction_in_the_Imbalanced_Datasets.pdf"", ""page"": 2, ""score"": 0.1723150610923767}, {""source"": ""Explainable Automated Machine Learning for Credit Decisions.pdf"", ""page"": 6, ""score"": 0.17607176303863525}]","[{""source"": ""An_Investigation_of_Credit_Card_Default_Prediction_in_the_Imbalanced_Datasets.pdf"", ""page"": 2, ""score"": 0.159410297870636, ""sentence"": ""The delinquency rate indicates the percentage of past-due loans within the bor- rower’s entire loan portfolio.""}, {""source"": ""An_Investigation_of_Credit_Card_Default_Prediction_in_the_Imbalanced_Datasets.pdf"", ""page"": 2, ""score"": 0.1723150610923767, ""sentence"": ""The stan- dard model depends on the ﬁnancial ratios, income account, and data on the balance sheet [6], [7].""}, {""source"": ""Explainable Automated Machine Learning for Credit Decisions.pdf"", ""page"": 6, ""score"": 0.17607176303863525, ""sentence"": ""Both accuracy and explainability are essential in aligning credit risk decisions with the dynamic demands o f the digital economy.""}]","{""min_docs"": 3, ""max_docs"": 20, ""min_gap"": 0.001, ""max_chunks_per_source"": 2, ""inspect_all"": false}"
206,SHAP/Test Dataset Local Shap 25/shap_tuples_non_prefix_206.json,UNKNOWN,UNKNOWN,3,checking_status_<0,Checking account status: balance below 0 DM.,decrease_risk,-0.022921584040926465,0.022921584040926465,Credit risk drivers: statistical investigation into how a negative checking account balance influences lower default likelihood in retail lending.,"Based on the provided regression analysis, a negative checking account balance (specifically, a balance below 0 DM) is positively associated with credit risk, directly contradicting the premise that it lowers default likelihood. The logistic model identifies checking account status as a highly significant discriminator, where applicants with balances under zero exhibit a substantially higher estimated probability of being classified as a bad credit risk relative to the reference group. This positive association aligns with the text's observation that key financial characteristics consistently align with basic economic intuition regarding default propensity. Conversely, the context explicitly notes that the category of having *no* checking account is associated with a lower estimated risk in this dataset, demonstrating that account absence does not carry the same risk profile as a negative balance. Both linear and logistic regression frameworks were utilized to assess these predictors, with checking account status emerging as a statistically significant variable in the logistic specification. Overall, the statistical evidence confirms that a negative checking account balance serves as a strong positive predictor of default probability in retail lending models.

**Evidence Bullets:**
- Checking account balance < 0 DM: Positively associated with a substantially higher estimated credit risk (identified as an important discriminator in the logistic model) (Source: regression-based credit risk modeling.pdf, p. 29).
- No checking account category: Associated with a lower estimated risk relative to the reference group, contrasting with the negative balance category (Source: regression-based credit risk modeling.pdf, p. 29).
- Statistical significance: Checking account status is explicitly listed among the most significant predictors alongside financial and loan characteristics in both linear and logistic frameworks (Source: regression-based credit risk modeling.pdf, p. 29).","[{""source"": ""regression-based credit risk modeling.pdf"", ""page"": 29, ""score"": 0.1951473355293274}, {""source"": ""regression-based credit risk modeling.pdf"", ""page"": 29, ""score"": 0.20774173736572266}, {""source"": ""The Application of Tree-based model to Unbalanced German Credit Data Analysis.pdf"", ""page"": 2, ""score"": 0.2141931653022766}, {""source"": ""Explainable Automated Machine Learning for Credit Decisions.pdf"", ""page"": 6, ""score"": 0.21530628204345703}, {""source"": ""An_Investigation_of_Credit_Card_Default_Prediction_in_the_Imbalanced_Datasets.pdf"", ""page"": 1, ""score"": 0.22021567821502686}]","[{""source"": ""regression-based credit risk modeling.pdf"", ""page"": 29, ""score"": 0.1951473355293274, ""sentence"": ""Applicants with a checking account balance below 0 DM (Deutsche Mark) exhibit a substantially higher estimated risk relative to the reference group, while the category of no checking account is associated with a lower estimated risk in this""}, {""source"": ""regression-based credit risk modeling.pdf"", ""page"": 29, ""score"": 0.20774173736572266, ""sentence"": ""while the category of no checking account is associated with a lower estimated risk in this dataset.""}, {""source"": ""The Application of Tree-based model to Unbalanced German Credit Data Analysis.pdf"", ""page"": 2, ""score"": 0.2141931653022766, ""sentence"": ""and low-risk groups with the information like gender, age and savings account.""}, {""source"": ""Explainable Automated Machine Learning for Credit Decisions.pdf"", ""page"": 6, ""score"": 0.21530628204345703, ""sentence"": ""Both accuracy and explainability are essential in aligning credit risk decisions with the dynamic demands o f the digital economy.""}, {""source"": ""An_Investigation_of_Credit_Card_Default_Prediction_in_the_Imbalanced_Datasets.pdf"", ""page"": 1, ""score"": 0.22021567821502686, ""sentence"": ""For more information, see https://creativecommons.org/licenses/by/4.0/ 201173""}]","{""min_docs"": 3, ""max_docs"": 20, ""min_gap"": 0.001, ""max_chunks_per_source"": 2, ""inspect_all"": false}"
