sample_idx,shap_json_path,prediction_label,prediction_probability,feature_rank,feature,feature_definition,feature_direction,feature_shap_value,feature_abs_shap,question,answer,selected_sources,evidence_sentences,retrieval_params
108,SHAP/Test Dataset Local Shap Correct/shap_tuples_non_prefix_108.json,UNKNOWN,UNKNOWN,1,duration,Loan duration in months.,decrease_risk,-0.04572203866392574,0.04572203866392574,Empirical analysis of loan duration in months as a determinant of reduced credit default probability.,"Based on the provided context, loan duration is identified as a key financial predictor of credit risk, but its empirical impact directly contradicts the premise that it reduces default probability. The analysis explicitly indicates that longer loan durations increase the likelihood of credit risk, aligning with standard theoretical expectations in credit scoring literature. Rather than serving as a mitigating factor, extended repayment periods are associated with a higher probability of borrower default. The context emphasizes that financial variables like duration and credit amount are more significant predictors of repayment ability than demographic characteristics. Consequently, duration functions as a positive risk driver in the regression framework, where an increase in months correlates with elevated default probability. This finding supports the use of duration as a critical input in OLS and regularized regression models for accurately separating good and bad borrowers.

Evidence Bullets:
- Duration is explicitly listed as a key risk indicator where longer durations increase the likelihood of credit risk (Source: regression-based credit risk modeling.pdf, page 23).
- The positive relationship between loan duration and default probability aligns with theoretical expectations in credit risk modeling, confirming its role as a significant financial predictor (Source: regression-based credit risk modeling.pdf, page 23).
- Financial variables, including duration, are highlighted as more important predictors of repayment ability than demographic characteristics in empirical credit scoring studies (Source: regression-based credit risk modeling.pdf, page 7).
- No specific regression coefficient or p-value for duration is provided in the excerpt, but the directional impact is clearly stated as increasing credit risk rather than reducing it (Source: regression-based credit risk modeling.pdf, page 23).","[{""source"": ""regression-based credit risk modeling.pdf"", ""page"": 23, ""score"": 0.17357689142227173}, {""source"": ""regression-based credit risk modeling.pdf"", ""page"": 7, ""score"": 0.17685234546661377}, {""source"": ""An_Investigation_of_Credit_Card_Default_Prediction_in_the_Imbalanced_Datasets.pdf"", ""page"": 2, ""score"": 0.18365824222564697}]","[{""source"": ""regression-based credit risk modeling.pdf"", ""page"": 23, ""score"": 0.17357689142227173, ""sentence"": ""These findings confirm that the reduced model serves as an effective descriptive benchmark.""}, {""source"": ""regression-based credit risk modeling.pdf"", ""page"": 7, ""score"": 0.17685234546661377, ""sentence"": ""Empirical work has exam- ined how demographic characteristics, such as age and marital status, and loan terms, such as loan size and interest rate, affect the borrower’s ability to repay on time (Özdemir, 2008).""}, {""source"": ""An_Investigation_of_Credit_Card_Default_Prediction_in_the_Imbalanced_Datasets.pdf"", ""page"": 2, ""score"": 0.18365824222564697, ""sentence"": ""The delinquency rate indicates the percentage of past-due loans within the bor- rower’s entire loan portfolio.""}]","{""min_docs"": 3, ""max_docs"": 20, ""min_gap"": 0.001, ""max_chunks_per_source"": 2, ""inspect_all"": false}"
108,SHAP/Test Dataset Local Shap Correct/shap_tuples_non_prefix_108.json,UNKNOWN,UNKNOWN,2,checking_status_no checking,Checking account status: no checking account.,increase_risk,0.044055455887300275,0.044055455887300275,Statistical impact of having no checking account status on increasing credit risk and default likelihood.,"Based on the provided context, the ""no checking account"" status demonstrates a negative association with credit risk, meaning it actually decreases rather than increases the likelihood of default. In the regression-based credit risk modeling analysis, checking account status functions as a statistically significant discriminator within the logistic model. Specifically, applicants categorized as having no checking account are associated with a lower estimated risk compared to the reference group. This finding directly contrasts with applicants who hold a checking account balance below 0 DM, who exhibit a substantially higher estimated risk. Although the provided excerpts do not list the exact regression coefficient or p-value for this specific categorical level, the text explicitly confirms its statistical significance and inverse relationship with default probability. Consequently, the data indicates that lacking a checking account correlates with a reduced probability of being classified as a bad credit risk in this dataset.

**Evidence Bullets:**
- The ""no checking account"" category is explicitly associated with a lower estimated risk relative to the reference group, indicating a negative directional impact on default likelihood (Source: regression-based credit risk modeling.pdf, p. 29).
- Checking account status emerges as a statistically significant discriminator in the logistic model, with risk direction varying by balance category rather than uniformly increasing risk (Source: regression-based credit risk modeling.pdf, p. 29).
- While exact beta coefficients are not provided in the excerpt, the text confirms the category's statistical significance and its role in reducing estimated credit risk compared to negative-balance accounts (Source: regression-based credit risk modeling.pdf, p. 29).","[{""source"": ""regression-based credit risk modeling.pdf"", ""page"": 29, ""score"": 0.20419210195541382}, {""source"": ""regression-based credit risk modeling.pdf"", ""page"": 29, ""score"": 0.23248016834259033}, {""source"": ""An_Investigation_of_Credit_Card_Default_Prediction_in_the_Imbalanced_Datasets.pdf"", ""page"": 23, ""score"": 0.23802465200424194}, {""source"": ""An_Investigation_of_Credit_Card_Default_Prediction_in_the_Imbalanced_Datasets.pdf"", ""page"": 2, ""score"": 0.24023646116256714}]","[{""source"": ""regression-based credit risk modeling.pdf"", ""page"": 29, ""score"": 0.20419210195541382, ""sentence"": ""while the category of no checking account is associated with a lower estimated risk in this dataset.""}, {""source"": ""regression-based credit risk modeling.pdf"", ""page"": 29, ""score"": 0.23248016834259033, ""sentence"": ""Applicants with a checking account balance below 0 DM (Deutsche Mark) exhibit a substantially higher estimated risk relative to the reference group, while the category of no checking account is associated with a lower estimated risk in this""}, {""source"": ""An_Investigation_of_Credit_Card_Default_Prediction_in_the_Imbalanced_Datasets.pdf"", ""page"": 23, ""score"": 0.23802465200424194, ""sentence"": ""This low-productivity, signiﬁcant expense conjectures cannot meet consumer ﬁnance enterprise’s credit""}, {""source"": ""An_Investigation_of_Credit_Card_Default_Prediction_in_the_Imbalanced_Datasets.pdf"", ""page"": 2, ""score"": 0.24023646116256714, ""sentence"": ""default client from non-defaulted [8] because these parame- ters may enhance the performance of models.""}]","{""min_docs"": 3, ""max_docs"": 20, ""min_gap"": 0.001, ""max_chunks_per_source"": 2, ""inspect_all"": false}"
108,SHAP/Test Dataset Local Shap Correct/shap_tuples_non_prefix_108.json,UNKNOWN,UNKNOWN,3,savings_status_no known savings,Savings account status: no known savings account.,decrease_risk,-0.04160019129535835,0.04160019129535835,Investigation into the relationship between no known savings account status and the reduction of credit risk.,"Based on the provided context, the relationship between savings account status and credit risk indicates that lower savings levels are associated with an increase, rather than a reduction, in estimated credit risk. The text explicitly notes that compared to a reference category (likely representing higher or moderate savings), lower savings categories correlate with higher risk. Consequently, a status of ""no known savings"" would logically align with these lower categories and predict a higher probability of default. However, the analysis also highlights that not all specific savings levels demonstrate statistically significant differences from the reference category, suggesting the predictive power of savings may vary depending on the exact threshold or model specification. In one model iteration, the ""Savings"" variable was ultimately excluded from the reduced model, indicating it may not have consistently met the threshold for statistical relevance across all tested frameworks. Therefore, while savings status is generally informative, the evidence contradicts the premise that lacking a savings account reduces credit risk; instead, it points toward a positive association with risk, albeit with mixed statistical significance.

**Evidence Bullets:**
- Lower savings categories show a positive association with estimated credit risk relative to the reference category, although the text notes that not all savings levels exhibit statistically significant differences (Source: regression-based credit risk modeling.pdf, page 29).
- The ""Savings"" predictor was explicitly removed from a reduced regression model, suggesting it failed to meet the criteria for statistical relevance in that specific model specification (Source: regression-based credit risk modeling.pdf, page 23).
- Financial variables like savings are generally more predictive of credit risk than demographic factors, but the direction of impact is positive (increases risk) for lower savings tiers rather than negative (reduces risk) (Source: regression-based credit risk modeling.pdf, page 29).","[{""source"": ""regression-based credit risk modeling.pdf"", ""page"": 29, ""score"": 0.19418561458587646}, {""source"": ""How much do we see? On the explainability of partial dependence plots for credit risk scoring.pdf"", ""page"": 10, ""score"": 0.22276771068572998}, {""source"": ""regression-based credit risk modeling.pdf"", ""page"": 23, ""score"": 0.22871673107147217}]","[{""source"": ""regression-based credit risk modeling.pdf"", ""page"": 29, ""score"": 0.19418561458587646, ""sentence"": ""Savings are also informative.""}, {""source"": ""How much do we see? On the explainability of partial dependence plots for credit risk scoring.pdf"", ""page"": 10, ""score"": 0.22276771068572998, ""sentence"": ""2D PDP for the variables status account and duration.""}, {""source"": ""regression-based credit risk modeling.pdf"", ""page"": 23, ""score"": 0.22871673107147217, ""sentence"": ""PredictorsPresent residence,Number of credits,People liableandTelephoneas well as dummy-encoded categorical groupsPersonal status,Other installment plans,Housing,Prop- erty,JobandSavingswere removed.""}]","{""min_docs"": 3, ""max_docs"": 20, ""min_gap"": 0.001, ""max_chunks_per_source"": 2, ""inspect_all"": false}"
