sample_idx,shap_json_path,prediction_label,prediction_probability,feature_rank,feature,feature_definition,feature_direction,feature_shap_value,feature_abs_shap,question,answer,selected_sources,evidence_sentences,retrieval_params
23,SHAP/All Dataset Local Shap/shap_tuples_non_prefix_23.json,GOOD CREDIT RISK,0.29845541604509385,1,credit_history_critical/other existing credit,Credit history: critical account or other existing credits.,decrease_risk,-0.05855118069834754,0.05855118069834754,Empirical analysis of the association between critical credit history or other existing credits and reduced credit default probability.,"Based on the provided context, the empirical analysis indicates that a credit history categorized as ""critical"" or ""delay"" does not strictly predict a higher likelihood of default. Instead, the data demonstrates that applicants with such histories can still successfully obtain financing and be classified into the ""good"" risk category, suggesting a negative or neutral association with default probability rather than a positive one. The context does not provide specific regression coefficients or p-values to quantify the statistical significance of credit history, nor does it contain any empirical findings regarding ""other existing credits."" Consequently, while theoretical models often treat poor credit history as a primary risk driver, this specific dataset analysis reveals that critical history alone is not a deterministic predictor of bad credit risk. The overall modeling approach relies on OLS and logistic regression to establish interpretive baselines, but the explicit statistical direction for credit history remains qualitative in the provided excerpts. Therefore, the evidence supports the premise that critical credit history can coexist with a reduced default probability classification when evaluated within a broader predictive framework.

**Evidence Bullets:**
- Critical/Delay Credit History: Associated with classification into the ""good"" risk class, indicating a direction that does not increase (and may reduce) default probability, though no specific coefficient or p-value is reported (Source: DATA PREPARATION FOR DATA MINING..., p. 13).
- Credit History (General): Listed as a key risk indicator alongside duration and credit amount, but the text does not provide a quantified regression coefficient or significance level for its impact (Source: regression-based credit risk modeling.pdf, p. 23).
- Other Existing Credits: Not mentioned or analyzed in the provided context, so no empirical association or statistical direction with credit risk can be determined from the given excerpts (Source: N/A within provided context).","[{""source"": ""regression-based credit risk modeling.pdf"", ""page"": 23, ""score"": 0.1618504524230957}, {""source"": ""DATA PREPARATION FOR DATA MINING BASED ON NEURAL NETWORK- A CASE STUDY ON GERMAN CREDIT CLASSIFICATION DATASET.pdf"", ""page"": 13, ""score"": 0.1757906675338745}, {""source"": ""regression-based credit risk modeling.pdf"", ""page"": 2, ""score"": 0.17615103721618652}]","[{""source"": ""regression-based credit risk modeling.pdf"", ""page"": 23, ""score"": 0.1618504524230957, ""sentence"": ""These findings confirm that the reduced model serves as an effective descriptive benchmark.""}, {""source"": ""DATA PREPARATION FOR DATA MINING BASED ON NEURAL NETWORK- A CASE STUDY ON GERMAN CREDIT CLASSIFICATION DATASET.pdf"", ""page"": 13, ""score"": 0.1757906675338745, ""sentence"": ""Although some customers have bad credit history or risky credit experience, which is categorized as critical or delay on attribute credit-history, it is found that it is still possible for them to obtain the credit, as they can be included into the good class.""}, {""source"": ""regression-based credit risk modeling.pdf"", ""page"": 2, ""score"": 0.17615103721618652, ""sentence"": ""The analysis uses the Statlog German Credit Data, which contains 1000 credit applicants described by their demographic, financial, and credit-related variables""}]","{""min_docs"": 3, ""max_docs"": 20, ""min_gap"": 0.001, ""max_chunks_per_source"": 2, ""inspect_all"": false}"
23,SHAP/All Dataset Local Shap/shap_tuples_non_prefix_23.json,GOOD CREDIT RISK,0.29845541604509385,2,checking_status_no checking,Checking account status: no checking account.,increase_risk,0.0519601228640855,0.0519601228640855,Statistical investigation into the contribution of the absence of a checking account to elevated credit risk.,"Based on the provided context, the absence of a checking account does not contribute to elevated credit risk; instead, it is associated with a lower estimated risk. This finding directly contradicts the premise that lacking a checking account increases default probability. In the regression-based credit risk modeling analysis, the ""no checking account"" category demonstrates a clear negative directional impact on credit risk, indicating that applicants without a checking account are less likely to be classified as high-risk borrowers within this specific dataset. Although the exact regression coefficient is not explicitly reported in the excerpt, the model identifies this categorical variable as an informative predictor that inversely correlates with default likelihood. This suggests that, for the studied population, traditional assumptions regarding bank account ownership may be outweighed by other financial or behavioral indicators captured in the model. Consequently, statistical evidence from this dataset confirms that the absence of a checking account functions as a risk-mitigating factor rather than a risk-elevating one.

**Evidence Bullets:**
- The ""no checking account"" category is explicitly associated with a lower estimated credit risk in the regression analysis (Source: regression-based credit risk modeling.pdf, page 29).
- This variable exhibits a negative directional relationship with default probability, meaning its presence reduces rather than elevates risk estimates (Source: regression-based credit risk modeling.pdf, page 29).
- While the precise beta coefficient is not provided in the text, the model retains this categorical indicator as an informative predictor within the credit risk framework (Source: regression-based credit risk modeling.pdf, page 29).","[{""source"": ""regression-based credit risk modeling.pdf"", ""page"": 29, ""score"": 0.23432767391204834}, {""source"": ""Research on Credit Risk Assessment Optimization based on Machine Learning.pdf"", ""page"": 2, ""score"": 0.2460172176361084}, {""source"": ""regression-based credit risk modeling.pdf"", ""page"": 23, ""score"": 0.25114309787750244}]","[{""source"": ""regression-based credit risk modeling.pdf"", ""page"": 29, ""score"": 0.23432767391204834, ""sentence"": ""while the category of no checking account is associated with a lower estimated risk in this dataset.""}, {""source"": ""Research on Credit Risk Assessment Optimization based on Machine Learning.pdf"", ""page"": 2, ""score"": 0.2460172176361084, ""sentence"": ""assessed [2].""}, {""source"": ""regression-based credit risk modeling.pdf"", ""page"": 23, ""score"": 0.25114309787750244, ""sentence"": ""Even after exclusions, the reduced OLS model still shows limited explanatory power, with an R2 of 0.24 (Adj.R 2 =0.22) and a lower but still elevated condition number (=3.78×10 4).""}]","{""min_docs"": 3, ""max_docs"": 20, ""min_gap"": 0.001, ""max_chunks_per_source"": 2, ""inspect_all"": false}"
23,SHAP/All Dataset Local Shap/shap_tuples_non_prefix_23.json,GOOD CREDIT RISK,0.29845541604509385,3,purpose_used car,Loan purpose: purchase of a used car.,decrease_risk,-0.0439867945945622,0.0439867945945622,Determinants of credit risk reduction associated with loan purposes specifically for the purchase of used vehicles.,"Based strictly on the provided context, there is no empirical evidence, regression output, or statistical analysis detailing the relationship between loan purposes for used vehicles and credit risk reduction. The excerpts generally describe credit risk assessment as a process where banks evaluate applicants using broad criteria such as the credit object, risk level, and grace period to prevent non-performing loans. While the texts emphasize that data mining and machine learning techniques are utilized to extract predictive insights from historical application datasets and optimize approval decision rules, they do not isolate or quantify the impact of specific loan purposes like used vehicle purchases. Consequently, no directional impact (positive or negative coefficient) or statistical significance can be established for this variable from the given materials. The provided content focuses on the overarching institutional goal of maximizing profitability while minimizing default risk through generalized applicant profiling rather than granular, purpose-specific regression results. Therefore, the specific determinant requested cannot be validated or quantified using only the supplied text.

**Evidence Bullets:**
- The context lists ""credit object,"" ""risk level,"" and ""grace period"" as general factors considered during customer selection, but provides no regression coefficients, p-values, or directional impacts for these variables (Source: Comparative_Analysis_of_Machine_Learning.pdf, page 1).
- Non-performing loans are identified as the primary risk in loan distribution, with data mining proposed as a mitigation strategy, though no statistical tables or quantitative results for specific loan purposes are reported (Source: South German Credit Data Classification Using Random Forest Algorithm to Predict Bank Credit Receipts.pdf, page 1).
- High credit risk is defined qualitatively as a low likelihood of repayment that leads to financial loss, but the text does not present any coefficient estimates or significance tests linking vehicle purchase purposes to default probability (Source: Comparative_Analysis_of_Machine_Learning.pdf, page 3).","[{""source"": ""Comparative_Analysis_of_Machine_Learning.pdf"", ""page"": 1, ""score"": 0.22014260292053223}, {""source"": ""South German Credit Data Classification Using Random Forest Algorithm to Predict Bank Credit Receipts.pdf"", ""page"": 1, ""score"": 0.2234460711479187}, {""source"": ""Comparative_Analysis_of_Machine_Learning.pdf"", ""page"": 3, ""score"": 0.22609299421310425}, {""source"": ""Research on Credit Risk Assessment Optimization based on Machine Learning.pdf"", ""page"": 2, ""score"": 0.22824382781982422}]","[{""source"": ""Comparative_Analysis_of_Machine_Learning.pdf"", ""page"": 1, ""score"": 0.22014260292053223, ""sentence"": ""This choice is essential due to the fact that a bank marketer must be capable of safeguarding his clients against non-performing loans, which frequently constitute the primary risk in each loan distribution [2].""}, {""source"": ""South German Credit Data Classification Using Random Forest Algorithm to Predict Bank Credit Receipts.pdf"", ""page"": 1, ""score"": 0.2234460711479187, ""sentence"": ""which requires the borrower to pay off the loan at a certain time [1].""}, {""source"": ""Comparative_Analysis_of_Machine_Learning.pdf"", ""page"": 3, ""score"": 0.22609299421310425, ""sentence"": ""go ahead with the loan approval or not.""}, {""source"": ""Research on Credit Risk Assessment Optimization based on Machine Learning.pdf"", ""page"": 2, ""score"": 0.22824382781982422, ""sentence"": ""assessed [2].""}]","{""min_docs"": 3, ""max_docs"": 20, ""min_gap"": 0.001, ""max_chunks_per_source"": 2, ""inspect_all"": false}"
