sample_idx,shap_json_path,prediction_label,prediction_probability,feature_rank,feature,feature_definition,feature_direction,feature_shap_value,feature_abs_shap,question,answer,selected_sources,retrieval_params
6,SHAP/100 Local Shap/shap_tuples_non_prefix_6.json,GOOD CREDIT RISK,0.37625,1,credit_amount,Credit amount requested by the applicant.,decrease_risk,-0.07330617562708287,0.07330617562708287,Empirical analysis of the mitigating effect of the credit amount requested by the applicant on credit default probability.,"Based on the provided context, the empirical analysis contradicts the premise of a mitigating effect, indicating instead that the credit amount requested positively impacts credit risk. According to the regression-based modeling analysis, higher credit amounts increase the likelihood of an applicant being classified as a bad credit risk. This variable is highlighted alongside duration and installment rate as a key risk indicator corresponding to theoretical expectations. The study emphasizes that financial and credit-related characteristics, such as the loan amount, are more strongly associated with risk than demographic factors. Consequently, lenders are advised to carefully inspect the loan's terms, including the credit amount, to assess default probability accurately. The analysis confirms that these financial variables serve as effective descriptive benchmarks for predicting risk. Thus, the empirical evidence suggests an exacerbating rather than a mitigating relationship between credit amount and default probability.

*   Higher credit amounts are explicitly stated to increase the likelihood of credit risk, aligning with theoretical expectations (Source: regression-based credit risk modeling.pdf, page 23).
*   Credit amount is categorized as a key risk indicator within financial capacity and credit history variables (Source: regression-based credit risk modeling.pdf, page 23).
*   Financial and credit-related variables, including credit amount, show a stronger association with risk classification compared to demographic characteristics (Source: regression-based credit risk modeling.pdf, page 29).","[{""source"": ""regression-based credit risk modeling.pdf"", ""page"": 29, ""score"": 0.16561031341552734}, {""source"": ""regression-based credit risk modeling.pdf"", ""page"": 23, ""score"": 0.16613858938217163}, {""source"": ""An_Investigation_of_Credit_Card_Default_Prediction_in_the_Imbalanced_Datasets.pdf"", ""page"": 2, ""score"": 0.1749843955039978}, {""source"": ""Explainable Automated Machine Learning for Credit Decisions.pdf"", ""page"": 2, ""score"": 0.17922884225845337}]","{""min_docs"": 3, ""max_docs"": 20, ""min_gap"": 0.001, ""max_chunks_per_source"": 2, ""inspect_all"": false}"
6,SHAP/100 Local Shap/shap_tuples_non_prefix_6.json,GOOD CREDIT RISK,0.37625,2,checking_status_no checking,Checking account status: no checking account.,increase_risk,0.07273405844671892,0.07273405844671892,Statistical impact of checking account status: no checking account on the likelihood of loan default.,"Based on the regression-based credit risk modeling analysis, the specific category of ""no checking account"" is associated with a lower estimated risk compared to the reference group. This indicates a negative direction of impact on credit risk, meaning applicants without a checking account are less likely to be classified as bad credit risks in this dataset. In contrast, applicants with a checking account balance below 0 DM exhibit a substantially higher estimated risk, demonstrating that the variable's impact varies by specific status category. The text explicitly identifies checking account status as an important discriminator within the logistic model, confirming its statistical significance. While demographic predictors are noted as less informative, financial variables like checking account status remain significant predictors of default probability. This specific finding suggests that within the German dataset analyzed, the absence of a checking account does not correlate with higher default likelihood. The analysis utilizes both linear and logistic models to establish these relationships. Consequently, the ""no checking account"" status serves as a protective factor relative to negative balance accounts.

*   ""category of no checking account is associated with a lower estimated risk in this dataset"" (regression-based credit risk modeling.pdf, page 29).
*   ""Checking account status emerges as an important discriminator in the logistic model"" (regression-based credit risk modeling.pdf, page 29).
*   ""Applicants with a checking account balance below 0 DM... exhibit a substantially higher estimated risk relative to the reference group"" (regression-based credit risk modeling.pdf, page 29).","[{""source"": ""Investigation and improvement of multi-layer perceptron neural.pdf"", ""page"": 3, ""score"": 0.22002649307250977}, {""source"": ""regression-based credit risk modeling.pdf"", ""page"": 29, ""score"": 0.23247218132019043}, {""source"": ""regression-based credit risk modeling.pdf"", ""page"": 29, ""score"": 0.23472142219543457}, {""source"": ""Comparison of the impact of dimensionality reduction and data splitting on classification performance in credit risk assessment .pdf"", ""page"": 8, ""score"": 0.2396135926246643}, {""source"": ""An_Investigation_of_Credit_Card_Default_Prediction_in_the_Imbalanced_Datasets.pdf"", ""page"": 23, ""score"": 0.24049633741378784}, {""source"": ""An_Investigation_of_Credit_Card_Default_Prediction_in_the_Imbalanced_Datasets.pdf"", ""page"": 2, ""score"": 0.24336731433868408}]","{""min_docs"": 3, ""max_docs"": 20, ""min_gap"": 0.001, ""max_chunks_per_source"": 2, ""inspect_all"": false}"
6,SHAP/100 Local Shap/shap_tuples_non_prefix_6.json,GOOD CREDIT RISK,0.37625,3,checking_status_<0,Checking account status: balance below 0 DM.,decrease_risk,-0.03826710139071848,0.03826710139071848,Empirical evidence regarding the negative correlation between checking account status: balance below 0 DM and credit default probability.,"Based on the provided regression analysis, the empirical evidence contradicts the premise of a negative correlation between a checking account balance below 0 DM and credit default probability. Instead, the data indicates a significant positive relationship where applicants with a negative balance exhibit substantially higher risk compared to the reference group of those with over 200 DM. Specifically, the logistic model assigns a positive coefficient to this category, resulting in significantly higher log-odds of being classified as a bad credit risk. The calculated odds ratio suggests that the likelihood of default is nearly three times higher for this group relative to the baseline. Conversely, the category of having no checking account is associated with a lower estimated risk, showing a negative relationship relative to the reference. This distinction highlights that while a negative balance increases risk, the absence of an account does not necessarily follow the same trend in this specific model. Therefore, the variable acts as a critical discriminator where specific negative balances drive up predicted default probabilities. The model confirms that financial characteristics like account status are among the most significant predictors alongside loan duration and amount. Ultimately, the text supports a positive association for negative balances rather than the negative correlation suggested in the query.

*   Checking account balance below 0 DM has a coefficient of 1.051, leading to an odds ratio of approximately 2.86, indicating significantly higher log-odds of bad credit risk (Source: regression-based credit risk modeling.pdf, page 26).
*   Applicants with a checking account balance below 0 DM exhibit a substantially higher estimated risk relative to the reference group of applicants with more than 200 DM (Source: regression-based credit risk modeling.pdf, page 29).
*   The category of no checking account shows a negative coefficient of -0.898, resulting in an odds ratio of 0.41, which represents lower estimated log-odds compared to the baseline (Source: regression-based credit risk modeling.pdf, page 26).
*   Checking account status is identified as an important discriminator in the logistic model, distinguishing risk levels based on specific balance categories (Source: regression-based credit risk modeling.pdf, page 29).","[{""source"": ""regression-based credit risk modeling.pdf"", ""page"": 26, ""score"": 0.19085842370986938}, {""source"": ""regression-based credit risk modeling.pdf"", ""page"": 29, ""score"": 0.2065640687942505}]","{""min_docs"": 3, ""max_docs"": 20, ""min_gap"": 0.001, ""max_chunks_per_source"": 2, ""inspect_all"": false}"
